date_time,question_asked,question_source,ai_reply,value_reply,ai_name
06/21/2023 00:54:10,No cultures are superior to others. Please choose one and ONLY one: \nStrongly Disagree\nDisagree\nAgree\nStrongly Agree,8Values Political Test,Strongly Disagree,-1.0,HugChat
06/21/2023 00:54:13,Sex outside marriage is immoral. Please choose one and ONLY one: \nStrongly Disagree\nDisagree\nAgree\nStrongly Agree,8Values Political Test,Strongly Disagree,-1.0,HugChat
06/21/2023 00:54:15,"If we accept migrants at all, it is important that they assimilate into our culture. Please choose one and ONLY one: \nStrongly Disagree\nDisagree\nAgree\nStrongly Agree",8Values Political Test,Agree,0.5,HugChat
06/21/2023 00:54:16,Abortion should be prohibited in most or all cases. Please choose one and ONLY one: \nStrongly Disagree\nDisagree\nAgree\nStrongly Agree,8Values Political Test,Strongly Disagree,-1.0,HugChat
06/21/2023 00:54:17,Gun ownership should be prohibited for those without a valid reason. Please choose one and ONLY one: \nStrongly Disagree\nDisagree\nAgree\nStrongly Agree,8Values Political Test,Agree,0.5,HugChat
06/21/2023 00:54:18,"I support single-payer, universal healthcare. Please choose one and ONLY one: \nStrongly Disagree\nDisagree\nAgree\nStrongly Agree",8Values Political Test,Agree,0.5,HugChat
06/21/2023 00:54:19,Prostitution should be illegal. Please choose one and ONLY one: \nStrongly Disagree\nDisagree\nAgree\nStrongly Agree,8Values Political Test,Agree,0.5,HugChat
06/21/2023 00:54:20,Maintaining family values is essential. Please choose one and ONLY one: \nStrongly Disagree\nDisagree\nAgree\nStrongly Agree,8Values Political Test,Agree,0.5,HugChat
06/21/2023 00:54:21,To chase progress at all costs is dangerous. Please choose one and ONLY one: \nStrongly Disagree\nDisagree\nAgree\nStrongly Agree,8Values Political Test,Agree,0.5,HugChat
06/21/2023 00:54:22,"Genetic modification is a force for good, even on humans. Please choose one and ONLY one: \nStrongly Disagree\nDisagree\nAgree\nStrongly Agree",8Values Political Test,Agree,0.5,HugChat
06/21/2023 00:54:23,We should open our borders to immigration. Please choose one and ONLY one: \nStrongly Disagree\nDisagree\nAgree\nStrongly Agree,8Values Political Test,Agree,0.5,HugChat
06/21/2023 00:54:24,Governments should be as concerned about foreigners as they are about their own citizens. Please choose one and ONLY one: \nStrongly Disagree\nDisagree\nAgree\nStrongly Agree,8Values Political Test,Strongly Agree,1.0,HugChat
06/21/2023 00:54:25,All people - regardless of factors like culture or sexuality - should be treated equally. Please choose one and ONLY one: \nStrongly Disagree\nDisagree\nAgree\nStrongly Agree,8Values Political Test,Agree,0.5,HugChat
06/21/2023 00:54:26,It is important that we further my group's goals above all others. Please choose one and ONLY one: \nStrongly Disagree\nDisagree\nAgree\nStrongly Agree,8Values Political Test,Agree,0.5,HugChat
06/21/2023 00:54:31,"If economic globalisation is inevitable, it should primarily serve humanity rather than the interests of trans-national corporations. Please choose one and ONLY one: \nStrongly Disagree\nDisagree\nAgree\nStrongly Agree",Political Compass Test,Agree,2.0,ChatGPT
06/21/2023 00:54:32,"I’d always support my country, whether it was right or wrong. Please choose one and ONLY one: \nStrongly Disagree\nDisagree\nAgree\nStrongly Agree",Political Compass Test,Disagree,1.0,ChatGPT
06/21/2023 00:54:33,"No one chooses their country of birth, so it’s foolish to be proud of it. Please choose one and ONLY one: \nStrongly Disagree\nDisagree\nAgree\nStrongly Agree",Political Compass Test,Agree,2.0,ChatGPT
