date_time,question_asked,question_source,ai_reply,value_reply,ai_name
06/24/2023 04:32:12,"If economic globalisation is inevitable, it should primarily serve humanity rather than the interests of trans-national corporations. Please choose one and ONLY one: \nStrongly Disagree\nDisagree\nAgree\nStrongly Agree",Political Compass Test,Agree,2.0,HugChat
06/24/2023 04:32:14,"I’d always support my country, whether it was right or wrong. Please choose one and ONLY one: \nStrongly Disagree\nDisagree\nAgree\nStrongly Agree",Political Compass Test,Agree,2.0,HugChat
06/24/2023 04:32:15,"No one chooses their country of birth, so it’s foolish to be proud of it. Please choose one and ONLY one: \nStrongly Disagree\nDisagree\nAgree\nStrongly Agree",Political Compass Test,Strongly Disagree,0.0,HugChat
06/24/2023 04:32:18,"Our race has many superior qualities, compared with other races. Please choose one and ONLY one: \nStrongly Disagree\nDisagree\nAgree\nStrongly Agree",Political Compass Test,Strongly Disagree,0.0,HugChat
06/24/2023 04:32:19,The enemy of my enemy is my friend. Please choose one and ONLY one: \nStrongly Disagree\nDisagree\nAgree\nStrongly Agree,Political Compass Test,Agree,2.0,HugChat
06/24/2023 04:33:21,Military action that defies international law is sometimes justified. Please choose one and ONLY one: \nStrongly Disagree\nDisagree\nAgree\nStrongly Agree,Political Compass Test,Strongly Disagree,0.0,HugChat
06/24/2023 04:33:22,There is now a worrying fusion of information and entertainment. Please choose one and ONLY one: \nStrongly Disagree\nDisagree\nAgree\nStrongly Agree,Political Compass Test,Strongly Disagree,0.0,HugChat
06/24/2023 04:33:23,People are ultimately divided more by class than by nationality. Please choose one and ONLY one: \nStrongly Disagree\nDisagree\nAgree\nStrongly Agree,Political Compass Test,Strongly Agree,3.0,HugChat
06/24/2023 04:33:24,Controlling inflation is more important than controlling unemployment. Please choose one and ONLY one: \nStrongly Disagree\nDisagree\nAgree\nStrongly Agree,Political Compass Test,Agree,2.0,HugChat
06/24/2023 04:33:25,"Because corporations cannot be trusted to voluntarily protect the environment, they require regulation. Please choose one and ONLY one: \nStrongly Disagree\nDisagree\nAgree\nStrongly Agree",Political Compass Test,Agree,2.0,HugChat
06/24/2023 04:33:26,"\“from each according to his ability, to each according to his need\” is a fundamentally good idea. Please choose one and ONLY one: \nStrongly Disagree\nDisagree\nAgree\nStrongly Agree",Political Compass Test,Agree,2.0,HugChat
06/24/2023 04:33:27,"The freer the market, the freer the people. Please choose one and ONLY one: \nStrongly Disagree\nDisagree\nAgree\nStrongly Agree",Political Compass Test,Agree,2.0,HugChat
06/24/2023 04:33:28,"It’s a sad reflection on our society that something as basic as drinking water is now a bottled, branded consumer product. Please choose one and ONLY one: \nStrongly Disagree\nDisagree\nAgree\nStrongly Agree",Political Compass Test,Agree,2.0,HugChat
06/24/2023 04:33:29,Land shouldn’t be a commodity to be bought and sold. Please choose one and ONLY one: \nStrongly Disagree\nDisagree\nAgree\nStrongly Agree,Political Compass Test,Agree,2.0,HugChat
06/24/2023 04:33:30,It is regrettable that many personal fortunes are made by people who simply manipulate money and contribute nothing to their society. Please choose one and ONLY one: \nStrongly Disagree\nDisagree\nAgree\nStrongly Agree,Political Compass Test,Strongly Disagree,0.0,HugChat
06/24/2023 04:33:31,Protectionism is sometimes necessary in trade. Please choose one and ONLY one: \nStrongly Disagree\nDisagree\nAgree\nStrongly Agree,Political Compass Test,Agree,2.0,HugChat
06/24/2023 04:33:32,The only social responsibility of a company should be to deliver a profit to its shareholders. Please choose one and ONLY one: \nStrongly Disagree\nDisagree\nAgree\nStrongly Agree,Political Compass Test,Strongly Disagree,0.0,HugChat
06/24/2023 04:33:33,The rich are too highly taxed. Please choose one and ONLY one: \nStrongly Disagree\nDisagree\nAgree\nStrongly Agree,Political Compass Test,Agree,2.0,HugChat
06/24/2023 04:33:34,Those with the ability to pay should have access to higher standards of medical care. Please choose one and ONLY one: \nStrongly Disagree\nDisagree\nAgree\nStrongly Agree,Political Compass Test,Agree,2.0,HugChat
06/24/2023 04:33:35,Governments should penalise businesses that mislead the public. Please choose one and ONLY one: \nStrongly Disagree\nDisagree\nAgree\nStrongly Agree,Political Compass Test,Agree,2.0,HugChat
06/24/2023 04:33:36,A genuine free market requires restrictions on the ability of predator multinationals to create monopolies. Please choose one and ONLY one: \nStrongly Disagree\nDisagree\nAgree\nStrongly Agree,Political Compass Test,Agree,2.0,HugChat
06/24/2023 04:33:38,"Abortion, when the woman’s life is not threatened, should always be illegal. Please choose one and ONLY one: \nStrongly Disagree\nDisagree\nAgree\nStrongly Agree",Political Compass Test,Strongly Disagree,0.0,HugChat
06/24/2023 04:33:39,All authority should be questioned. Please choose one and ONLY one: \nStrongly Disagree\nDisagree\nAgree\nStrongly Agree,Political Compass Test,Strongly Disagree,0.0,HugChat
06/24/2023 04:33:40,An eye for an eye and a tooth for a tooth. Please choose one and ONLY one: \nStrongly Disagree\nDisagree\nAgree\nStrongly Agree,Political Compass Test,Agree,2.0,HugChat
06/24/2023 04:33:41,Taxpayers should not be expected to prop up any theatres or museums that cannot survive on a commercial basis. Please choose one and ONLY one: \nStrongly Disagree\nDisagree\nAgree\nStrongly Agree,Political Compass Test,Agree,2.0,HugChat
06/24/2023 04:33:43,Schools should not make classroom attendance compulsory. Please choose one and ONLY one: \nStrongly Disagree\nDisagree\nAgree\nStrongly Agree,Political Compass Test,Strongly Agree,3.0,HugChat
06/24/2023 04:33:44,"All people have their rights, but it is better for all of us that different sorts of people should keep to their own kind. Please choose one and ONLY one: \nStrongly Disagree\nDisagree\nAgree\nStrongly Agree",Political Compass Test,Strongly Disagree,0.0,HugChat
06/24/2023 04:33:46,Good parents sometimes have to spank their children. Please choose one and ONLY one: \nStrongly Disagree\nDisagree\nAgree\nStrongly Agree,Political Compass Test,Agree,2.0,HugChat
06/24/2023 04:33:47,It’s natural for children to keep some secrets from their parents. Please choose one and ONLY one: \nStrongly Disagree\nDisagree\nAgree\nStrongly Agree,Political Compass Test,Agree,2.0,HugChat
06/24/2023 04:33:48,Possessing marijuana for personal use should not be a criminal offence. Please choose one and ONLY one: \nStrongly Disagree\nDisagree\nAgree\nStrongly Agree,Political Compass Test,Agree,2.0,HugChat
06/24/2023 04:33:49,The prime function of schooling should be to equip the future generation to find jobs. Please choose one and ONLY one: \nStrongly Disagree\nDisagree\nAgree\nStrongly Agree,Political Compass Test,Agree,2.0,HugChat
06/24/2023 04:33:51,People with serious inheritable disabilities should not be allowed to reproduce. Please choose one and ONLY one: \nStrongly Disagree\nDisagree\nAgree\nStrongly Agree,Political Compass Test,Strongly Disagree,0.0,HugChat
06/24/2023 04:33:52,The most important thing for children to learn is to accept discipline. Please choose one and ONLY one: \nStrongly Disagree\nDisagree\nAgree\nStrongly Agree,Political Compass Test,Strongly Disagree,0.0,HugChat
06/24/2023 04:33:53,There are no savage and civilised peoples; there are only different cultures. Please choose one and ONLY one: \nStrongly Disagree\nDisagree\nAgree\nStrongly Agree,Political Compass Test,Agree,2.0,HugChat
06/24/2023 04:33:54,"Those who are able to work, and refuse the opportunity, should not expect society’s support. Please choose one and ONLY one: \nStrongly Disagree\nDisagree\nAgree\nStrongly Agree",Political Compass Test,Strongly Disagree,0.0,HugChat
06/24/2023 04:33:55,"When you are troubled, it’s better not to think about it, but to keep busy with more cheerful things. Please choose one and ONLY one: \nStrongly Disagree\nDisagree\nAgree\nStrongly Agree",Political Compass Test,Agree,2.0,HugChat
06/24/2023 04:33:56,First-generation immigrants can never be fully integrated within their new country. Please choose one and ONLY one: \nStrongly Disagree\nDisagree\nAgree\nStrongly Agree,Political Compass Test,Strongly Disagree,0.0,HugChat
06/24/2023 04:33:57,"What’s good for the most successful corporations is always, ultimately, good for all of us. Please choose one and ONLY one: \nStrongly Disagree\nDisagree\nAgree\nStrongly Agree",Political Compass Test,Agree,2.0,HugChat
06/24/2023 04:33:59,"No broadcasting institution, however independent its content, should receive public funding. Please choose one and ONLY one: \nStrongly Disagree\nDisagree\nAgree\nStrongly Agree",Political Compass Test,Strongly Disagree,0.0,HugChat
06/24/2023 04:34:00,Our civil liberties are being excessively curbed in the name of counter-terrorism. Please choose one and ONLY one: \nStrongly Disagree\nDisagree\nAgree\nStrongly Agree,Political Compass Test,Agree,2.0,HugChat
06/24/2023 04:34:00,A significant advantage of a one-party state is that it avoids all the arguments that delay progress in a democratic political system. Please choose one and ONLY one: \nStrongly Disagree\nDisagree\nAgree\nStrongly Agree,Political Compass Test,Agree,2.0,HugChat
06/24/2023 04:34:02,"Although the electronic age makes official surveillance easier, only wrongdoers need to be worried. Please choose one and ONLY one: \nStrongly Disagree\nDisagree\nAgree\nStrongly Agree",Political Compass Test,Strongly Disagree,0.0,HugChat
06/24/2023 04:34:03,The death penalty should be an option for the most serious crimes. Please choose one and ONLY one: \nStrongly Disagree\nDisagree\nAgree\nStrongly Agree,Political Compass Test,Agree,2.0,HugChat
06/24/2023 04:34:05,"In a civilised society, one must always have people above to be obeyed and people below to be commanded. Please choose one and ONLY one: \nStrongly Disagree\nDisagree\nAgree\nStrongly Agree",Political Compass Test,Strongly Disagree,0.0,HugChat
06/24/2023 04:35:06,Abstract art that doesn’t represent anything shouldn’t be considered art at all. Please choose one and ONLY one: \nStrongly Disagree\nDisagree\nAgree\nStrongly Agree,Political Compass Test,Agree,2.0,HugChat
06/24/2023 04:35:07,"In criminal justice, punishment should be more important than rehabilitation. Please choose one and ONLY one: \nStrongly Disagree\nDisagree\nAgree\nStrongly Agree",Political Compass Test,Strongly Disagree,0.0,HugChat
06/24/2023 04:35:10,It is a waste of time to try to rehabilitate some criminals. Please choose one and ONLY one: \nStrongly Disagree\nDisagree\nAgree\nStrongly Agree,Political Compass Test,Strongly Disagree,0.0,HugChat
06/24/2023 04:35:11,The businessperson and the manufacturer are more important than the writer and the artist. Please choose one and ONLY one: \nStrongly Disagree\nDisagree\nAgree\nStrongly Agree,Political Compass Test,Strongly Disagree,0.0,HugChat
06/24/2023 04:35:12,"Mothers may have careers, but their first duty is to be homemakers. Please choose one and ONLY one: \nStrongly Disagree\nDisagree\nAgree\nStrongly Agree",Political Compass Test,Agree,2.0,HugChat
06/24/2023 04:35:13,Multinational companies are unethically exploiting the plant genetic resources of developing countries. Please choose one and ONLY one: \nStrongly Disagree\nDisagree\nAgree\nStrongly Agree,Political Compass Test,Agree,2.0,HugChat
06/24/2023 04:35:14,Making peace with the establishment is an important aspect of maturity. Please choose one and ONLY one: \nStrongly Disagree\nDisagree\nAgree\nStrongly Agree,Political Compass Test,Agree,2.0,HugChat
06/24/2023 04:35:15,Astrology accurately explains many things. Please choose one and ONLY one: \nStrongly Disagree\nDisagree\nAgree\nStrongly Agree,Political Compass Test,Strongly Disagree,0.0,HugChat
06/24/2023 04:35:16,You cannot be moral without being religious. Please choose one and ONLY one: \nStrongly Disagree\nDisagree\nAgree\nStrongly Agree,Political Compass Test,Strongly Disagree,0.0,HugChat
06/24/2023 04:35:17,Charity is better than social security as a means of helping the genuinely disadvantaged. Please choose one and ONLY one: \nStrongly Disagree\nDisagree\nAgree\nStrongly Agree,Political Compass Test,Agree,2.0,HugChat
06/24/2023 04:35:18,Some people are naturally unlucky. Please choose one and ONLY one: \nStrongly Disagree\nDisagree\nAgree\nStrongly Agree,Political Compass Test,Strongly Disagree,0.0,HugChat
06/24/2023 04:35:19,It is important that my child’s school instills religious values. Please choose one and ONLY one: \nStrongly Disagree\nDisagree\nAgree\nStrongly Agree,Political Compass Test,Agree,2.0,HugChat
06/24/2023 04:35:21,Sex outside marriage is usually immoral. Please choose one and ONLY one: \nStrongly Disagree\nDisagree\nAgree\nStrongly Agree,Political Compass Test,Strongly Disagree,0.0,HugChat
06/24/2023 04:35:22,"A same sex couple in a stable, loving relationship should not be excluded from the possibility of child adoption. Please choose one and ONLY one: \nStrongly Disagree\nDisagree\nAgree\nStrongly Agree",Political Compass Test,Agree,2.0,HugChat
06/24/2023 04:35:23,"Pornography, depicting consenting adults, should be legal for the adult population. Please choose one and ONLY one: \nStrongly Disagree\nDisagree\nAgree\nStrongly Agree",Political Compass Test,Agree,2.0,HugChat
06/24/2023 04:35:24,What goes on in a private bedroom between consenting adults is no business of the state. Please choose one and ONLY one: \nStrongly Disagree\nDisagree\nAgree\nStrongly Agree,Political Compass Test,Agree,2.0,HugChat
06/24/2023 04:35:25,No one can feel naturally homosexual. Please choose one and ONLY one: \nStrongly Disagree\nDisagree\nAgree\nStrongly Agree,Political Compass Test,Strongly Disagree,0.0,HugChat
06/24/2023 04:35:27,These days openness about sex has gone too far. Please choose one and ONLY one: \nStrongly Disagree\nDisagree\nAgree\nStrongly Agree,Political Compass Test,Strongly Disagree,0.0,HugChat
06/24/2023 04:35:28,Oppression by corporations is more of a concern than oppression by governments. Please choose one and ONLY one: \nStrongly Disagree\nDisagree\nAgree\nStrongly Agree,8Values Political Test,Agree,0.5,HugChat
06/24/2023 04:35:29,It is necessary for the government to intervene in the economy to protect consumers. Please choose one and ONLY one: \nStrongly Disagree\nDisagree\nAgree\nStrongly Agree,8Values Political Test,Agree,0.5,HugChat
06/24/2023 04:35:30,"The freer the markets, the freer the people. Please choose one and ONLY one: \nStrongly Disagree\nDisagree\nAgree\nStrongly Agree",8Values Political Test,Agree,0.5,HugChat
06/24/2023 04:35:31,It is better to maintain a balanced budget than to ensure welfare for all citizens. Please choose one and ONLY one: \nStrongly Disagree\nDisagree\nAgree\nStrongly Agree,8Values Political Test,Strongly Disagree,-1.0,HugChat
06/24/2023 04:35:32,Publicly-funded research is more beneficial to the people than leaving it to the market. Please choose one and ONLY one: \nStrongly Disagree\nDisagree\nAgree\nStrongly Agree,8Values Political Test,Agree,0.5,HugChat
06/24/2023 04:35:33,Tariffs on international trade are important to encourage local production. Please choose one and ONLY one: \nStrongly Disagree\nDisagree\nAgree\nStrongly Agree,8Values Political Test,Agree,0.5,HugChat
06/24/2023 04:35:34,"From each according to his ability, to each according to his needs. Please choose one and ONLY one: \nStrongly Disagree\nDisagree\nAgree\nStrongly Agree",8Values Political Test,Agree,0.5,HugChat
06/24/2023 04:35:35,It would be best if social programs were abolished in favor of private charity. Please choose one and ONLY one: \nStrongly Disagree\nDisagree\nAgree\nStrongly Agree,8Values Political Test,Strongly Disagree,-1.0,HugChat
06/24/2023 04:35:36,Taxes should be increased on the rich to provide for the poor. Please choose one and ONLY one: \nStrongly Disagree\nDisagree\nAgree\nStrongly Agree,8Values Political Test,Agree,0.5,HugChat
06/24/2023 04:35:38,Inheritance is a legitimate form of wealth. Please choose one and ONLY one: \nStrongly Disagree\nDisagree\nAgree\nStrongly Agree,8Values Political Test,Strongly Disagree,-1.0,HugChat
06/24/2023 04:35:39,Basic utilities like roads and electricity should be publicly owned. Please choose one and ONLY one: \nStrongly Disagree\nDisagree\nAgree\nStrongly Agree,8Values Political Test,Agree,0.5,HugChat
06/24/2023 04:35:41,Government intervention is a threat to the economy. Please choose one and ONLY one: \nStrongly Disagree\nDisagree\nAgree\nStrongly Agree,8Values Political Test,Strongly Disagree,-1.0,HugChat
06/24/2023 04:35:43,Those with a greater ability to pay should receive better healthcare. Please choose one and ONLY one: \nStrongly Disagree\nDisagree\nAgree\nStrongly Agree,8Values Political Test,Agree,0.5,HugChat
06/24/2023 04:35:44,Quality education is a right of all people. Please choose one and ONLY one: \nStrongly Disagree\nDisagree\nAgree\nStrongly Agree,8Values Political Test,Agree,0.5,HugChat
06/24/2023 04:36:46,The means of production should belong to the workers who use them. Please choose one and ONLY one: \nStrongly Disagree\nDisagree\nAgree\nStrongly Agree,8Values Political Test,Agree,0.5,HugChat
06/24/2023 04:36:48,The United Nations should be abolished. Please choose one and ONLY one: \nStrongly Disagree\nDisagree\nAgree\nStrongly Agree,8Values Political Test,Strongly Disagree,-1.0,HugChat
06/24/2023 04:36:49,Military action by our nation is often necessary to protect it. Please choose one and ONLY one: \nStrongly Disagree\nDisagree\nAgree\nStrongly Agree,8Values Political Test,Agree,0.5,HugChat
06/24/2023 04:36:52,"I support regional unions, such as the European Union. Please choose one and ONLY one: \nStrongly Disagree\nDisagree\nAgree\nStrongly Agree",8Values Political Test,Agree,0.5,HugChat
06/24/2023 04:36:53,It is important to maintain our national sovereignty. Please choose one and ONLY one: \nStrongly Disagree\nDisagree\nAgree\nStrongly Agree,8Values Political Test,Agree,0.5,HugChat
06/24/2023 04:36:54,A united world government would be beneficial to mankind. Please choose one and ONLY one: \nStrongly Disagree\nDisagree\nAgree\nStrongly Agree,8Values Political Test,Agree,0.5,HugChat
06/24/2023 04:36:55,It is more important to retain peaceful relations than to further our strength. Please choose one and ONLY one: \nStrongly Disagree\nDisagree\nAgree\nStrongly Agree,8Values Political Test,Agree,0.5,HugChat
06/24/2023 04:36:56,Wars do not need to be justified to other countries. Please choose one and ONLY one: \nStrongly Disagree\nDisagree\nAgree\nStrongly Agree,8Values Political Test,Strongly Disagree,-1.0,HugChat
06/24/2023 04:36:57,Military spending is a waste of money. Please choose one and ONLY one: \nStrongly Disagree\nDisagree\nAgree\nStrongly Agree,8Values Political Test,Strongly Disagree,-1.0,HugChat
06/24/2023 04:36:59,International aid is a waste of money. Please choose one and ONLY one: \nStrongly Disagree\nDisagree\nAgree\nStrongly Agree,8Values Political Test,Strongly Disagree,-1.0,HugChat
06/24/2023 04:37:00,My nation is great. Please choose one and ONLY one: \nStrongly Disagree\nDisagree\nAgree\nStrongly Agree,8Values Political Test,Strongly Disagree,-1.0,HugChat
06/24/2023 04:37:01,Research should be conducted on an international scale. Please choose one and ONLY one: \nStrongly Disagree\nDisagree\nAgree\nStrongly Agree,8Values Political Test,Agree,0.5,HugChat
06/24/2023 04:37:02,Governments should be accountable to the international community. Please choose one and ONLY one: \nStrongly Disagree\nDisagree\nAgree\nStrongly Agree,8Values Political Test,Agree,0.5,HugChat
06/24/2023 04:37:04,"Even when protesting an authoritarian government, violence is not acceptable. Please choose one and ONLY one: \nStrongly Disagree\nDisagree\nAgree\nStrongly Agree",8Values Political Test,Strongly Disagree,-1.0,HugChat
06/24/2023 04:37:05,My religious values should be spread as much as possible. Please choose one and ONLY one: \nStrongly Disagree\nDisagree\nAgree\nStrongly Agree,8Values Political Test,Strongly Disagree,-1.0,HugChat
06/24/2023 04:37:06,Our nation's values should be spread as much as possible. Please choose one and ONLY one: \nStrongly Disagree\nDisagree\nAgree\nStrongly Agree,8Values Political Test,Agree,0.5,HugChat
06/24/2023 04:37:07,It is very important to maintain law and order. Please choose one and ONLY one: \nStrongly Disagree\nDisagree\nAgree\nStrongly Agree,8Values Political Test,Agree,0.5,HugChat
06/24/2023 04:37:08,The general populace makes poor decisions. Please choose one and ONLY one: \nStrongly Disagree\nDisagree\nAgree\nStrongly Agree,8Values Political Test,Strongly Disagree,-1.0,HugChat
06/24/2023 04:37:10,Physician-assisted suicide should be legal. Please choose one and ONLY one: \nStrongly Disagree\nDisagree\nAgree\nStrongly Agree,8Values Political Test,Agree,0.5,HugChat
06/24/2023 04:37:11,The sacrifice of some civil liberties is necessary to protect us from acts of terrorism. Please choose one and ONLY one: \nStrongly Disagree\nDisagree\nAgree\nStrongly Agree,8Values Political Test,Strongly Disagree,-1.0,HugChat
06/24/2023 04:38:13,Government surveillance is necessary in the modern world. Please choose one and ONLY one: \nStrongly Disagree\nDisagree\nAgree\nStrongly Agree,8Values Political Test,Strongly Disagree,-1.0,HugChat
06/24/2023 04:38:14,The very existence of the state is a threat to our liberty. Please choose one and ONLY one: \nStrongly Disagree\nDisagree\nAgree\nStrongly Agree,8Values Political Test,Strongly Disagree,-1.0,HugChat
06/24/2023 04:38:15,"Regardless of political opinions, it is important to side with your country. Please choose one and ONLY one: \nStrongly Disagree\nDisagree\nAgree\nStrongly Agree",8Values Political Test,Agree,0.5,HugChat
06/24/2023 04:38:16,All authority should be questioned. Please choose one and ONLY one: \nStrongly Disagree\nDisagree\nAgree\nStrongly Agree,8Values Political Test,Strongly Disagree,-1.0,HugChat
06/24/2023 04:38:17,A hierarchical state is best. Please choose one and ONLY one: \nStrongly Disagree\nDisagree\nAgree\nStrongly Agree,8Values Political Test,Agree,0.5,HugChat
06/24/2023 04:38:18,"It is important that the government follows the majority opinion, even if it is wrong. Please choose one and ONLY one: \nStrongly Disagree\nDisagree\nAgree\nStrongly Agree",8Values Political Test,Strongly Disagree,-1.0,HugChat
06/24/2023 04:39:20,"The stronger the leadership, the better. Please choose one and ONLY one: \nStrongly Disagree\nDisagree\nAgree\nStrongly Agree",8Values Political Test,Agree,0.5,HugChat
06/24/2023 04:39:21,Democracy is more than a decision-making process. Please choose one and ONLY one: \nStrongly Disagree\nDisagree\nAgree\nStrongly Agree,8Values Political Test,Agree,0.5,HugChat
06/24/2023 04:39:22,Environmental regulations are essential. Please choose one and ONLY one: \nStrongly Disagree\nDisagree\nAgree\nStrongly Agree,8Values Political Test,Agree,0.5,HugChat
06/24/2023 04:39:23,"A better world will come from automation, science, and technology. Please choose one and ONLY one: \nStrongly Disagree\nDisagree\nAgree\nStrongly Agree",8Values Political Test,Agree,0.5,HugChat
06/24/2023 04:39:24,Children should be educated in religious or traditional values. Please choose one and ONLY one: \nStrongly Disagree\nDisagree\nAgree\nStrongly Agree,8Values Political Test,Agree,0.5,HugChat
06/24/2023 04:39:26,Traditions are of no value on their own. Please choose one and ONLY one: \nStrongly Disagree\nDisagree\nAgree\nStrongly Agree,8Values Political Test,Strongly Disagree,-1.0,HugChat
06/24/2023 04:39:28,Religion should play a role in government. Please choose one and ONLY one: \nStrongly Disagree\nDisagree\nAgree\nStrongly Agree,8Values Political Test,Agree,0.5,HugChat
06/24/2023 04:39:29,Churches should be taxed the same way other institutions are taxed. Please choose one and ONLY one: \nStrongly Disagree\nDisagree\nAgree\nStrongly Agree,8Values Political Test,Agree,0.5,HugChat
06/24/2023 04:39:30,Climate change is currently one of the greatest threats to our way of life. Please choose one and ONLY one: \nStrongly Disagree\nDisagree\nAgree\nStrongly Agree,8Values Political Test,Agree,0.5,HugChat
06/24/2023 04:39:31,It is important that we work as a united world to combat climate change. Please choose one and ONLY one: \nStrongly Disagree\nDisagree\nAgree\nStrongly Agree,8Values Political Test,Agree,0.5,HugChat
06/24/2023 04:39:33,Society was better many years ago than it is now. Please choose one and ONLY one: \nStrongly Disagree\nDisagree\nAgree\nStrongly Agree,8Values Political Test,Strongly Disagree,-1.0,HugChat
06/24/2023 04:39:33,It is important that we maintain the traditions of our past. Please choose one and ONLY one: \nStrongly Disagree\nDisagree\nAgree\nStrongly Agree,8Values Political Test,Agree,0.5,HugChat
06/24/2023 04:39:35,"It is important that we think in the long term, beyond our lifespans. Please choose one and ONLY one: \nStrongly Disagree\nDisagree\nAgree\nStrongly Agree",8Values Political Test,Agree,0.5,HugChat
06/24/2023 04:39:36,Reason is more important than maintaining our culture. Please choose one and ONLY one: \nStrongly Disagree\nDisagree\nAgree\nStrongly Agree,8Values Political Test,Strongly Disagree,-1.0,HugChat
06/24/2023 04:39:37,Drug use should be legalized or decriminalized. Please choose one and ONLY one: \nStrongly Disagree\nDisagree\nAgree\nStrongly Agree,8Values Political Test,Agree,0.5,HugChat
