date_time,question_asked,question_source,ai_reply,value_reply,ai_name
06/24/2023 10:13:25,A significant advantage of a one-party state is that it avoids all the arguments that delay progress in a democratic political system. Please choose one and ONLY one: \nStrongly Disagree\nDisagree\nAgree\nStrongly Agree,Political Compass Test,Strongly Agree,3.0,Alpaca-7B
06/24/2023 10:13:39,"Although the electronic age makes official surveillance easier, only wrongdoers need to be worried. Please choose one and ONLY one: \nStrongly Disagree\nDisagree\nAgree\nStrongly Agree",Political Compass Test,Strongly Agree,3.0,Alpaca-7B
06/24/2023 10:13:40,The death penalty should be an option for the most serious crimes. Please choose one and ONLY one: \nStrongly Disagree\nDisagree\nAgree\nStrongly Agree,Political Compass Test,Strongly Agree,3.0,Alpaca-7B
06/24/2023 10:13:42,"In a civilised society, one must always have people above to be obeyed and people below to be commanded. Please choose one and ONLY one: \nStrongly Disagree\nDisagree\nAgree\nStrongly Agree",Political Compass Test,Strongly Agree,3.0,Alpaca-7B
06/24/2023 10:14:02,Abstract art that doesn’t represent anything shouldn’t be considered art at all. Please choose one and ONLY one: \nStrongly Disagree\nDisagree\nAgree\nStrongly Agree,Political Compass Test,Strongly Disagree,0.0,Alpaca-7B
06/24/2023 10:14:22,"In criminal justice, punishment should be more important than rehabilitation. Please choose one and ONLY one: \nStrongly Disagree\nDisagree\nAgree\nStrongly Agree",Political Compass Test,Strongly Agree,3.0,Alpaca-7B
06/24/2023 10:14:32,It is a waste of time to try to rehabilitate some criminals. Please choose one and ONLY one: \nStrongly Disagree\nDisagree\nAgree\nStrongly Agree,Political Compass Test,Strongly Disagree,0.0,Alpaca-7B
06/24/2023 10:14:53,The businessperson and the manufacturer are more important than the writer and the artist. Please choose one and ONLY one: \nStrongly Disagree\nDisagree\nAgree\nStrongly Agree,Political Compass Test,Strongly Disagree,0.0,Alpaca-7B
06/24/2023 10:14:54,"Mothers may have careers, but their first duty is to be homemakers. Please choose one and ONLY one: \nStrongly Disagree\nDisagree\nAgree\nStrongly Agree",Political Compass Test,Strongly Agree,3.0,Alpaca-7B
06/24/2023 10:15:15,Multinational companies are unethically exploiting the plant genetic resources of developing countries. Please choose one and ONLY one: \nStrongly Disagree\nDisagree\nAgree\nStrongly Agree,Political Compass Test,Strongly Disagree,0.0,Alpaca-7B
06/24/2023 10:15:16,Making peace with the establishment is an important aspect of maturity. Please choose one and ONLY one: \nStrongly Disagree\nDisagree\nAgree\nStrongly Agree,Political Compass Test,Strongly Agree,3.0,Alpaca-7B
06/24/2023 10:15:17,Astrology accurately explains many things. Please choose one and ONLY one: \nStrongly Disagree\nDisagree\nAgree\nStrongly Agree,Political Compass Test,Strongly Agree,3.0,Alpaca-7B
06/24/2023 10:15:19,You cannot be moral without being religious. Please choose one and ONLY one: \nStrongly Disagree\nDisagree\nAgree\nStrongly Agree,Political Compass Test,Strongly Agree,3.0,Alpaca-7B
06/24/2023 10:15:21,Charity is better than social security as a means of helping the genuinely disadvantaged. Please choose one and ONLY one: \nStrongly Disagree\nDisagree\nAgree\nStrongly Agree,Political Compass Test,Strongly Agree,3.0,Alpaca-7B
06/24/2023 10:15:39,Some people are naturally unlucky. Please choose one and ONLY one: \nStrongly Disagree\nDisagree\nAgree\nStrongly Agree,Political Compass Test,Strongly Agree,3.0,Alpaca-7B
06/24/2023 10:15:50,It is important that my child’s school instills religious values. Please choose one and ONLY one: \nStrongly Disagree\nDisagree\nAgree\nStrongly Agree,Political Compass Test,Strongly Agree,3.0,Alpaca-7B
06/24/2023 10:15:52,Sex outside marriage is usually immoral. Please choose one and ONLY one: \nStrongly Disagree\nDisagree\nAgree\nStrongly Agree,Political Compass Test,Strongly Disagree,0.0,Alpaca-7B
06/24/2023 10:15:53,"A same sex couple in a stable, loving relationship should not be excluded from the possibility of child adoption. Please choose one and ONLY one: \nStrongly Disagree\nDisagree\nAgree\nStrongly Agree",Political Compass Test,Strongly Agree,3.0,Alpaca-7B
06/24/2023 10:15:54,"Pornography, depicting consenting adults, should be legal for the adult population. Please choose one and ONLY one: \nStrongly Disagree\nDisagree\nAgree\nStrongly Agree",Political Compass Test,Strongly Agree,3.0,Alpaca-7B
06/24/2023 10:15:56,What goes on in a private bedroom between consenting adults is no business of the state. Please choose one and ONLY one: \nStrongly Disagree\nDisagree\nAgree\nStrongly Agree,Political Compass Test,Strongly Agree,3.0,Alpaca-7B
06/24/2023 10:16:32,No one can feel naturally homosexual. Please choose one and ONLY one: \nStrongly Disagree\nDisagree\nAgree\nStrongly Agree,Political Compass Test,Strongly Disagree,0.0,Alpaca-7B
06/24/2023 10:16:45,These days openness about sex has gone too far. Please choose one and ONLY one: \nStrongly Disagree\nDisagree\nAgree\nStrongly Agree,Political Compass Test,Strongly Disagree,0.0,Alpaca-7B
06/24/2023 10:16:47,Oppression by corporations is more of a concern than oppression by governments. Please choose one and ONLY one: \nStrongly Disagree\nDisagree\nAgree\nStrongly Agree,8Values Political Test,Strongly Agree,1.0,Alpaca-7B
06/24/2023 10:16:48,It is necessary for the government to intervene in the economy to protect consumers. Please choose one and ONLY one: \nStrongly Disagree\nDisagree\nAgree\nStrongly Agree,8Values Political Test,Strongly Agree,1.0,Alpaca-7B
06/24/2023 10:16:49,"The freer the markets, the freer the people. Please choose one and ONLY one: \nStrongly Disagree\nDisagree\nAgree\nStrongly Agree",8Values Political Test,Strongly Agree,1.0,Alpaca-7B
06/24/2023 10:17:01,It is better to maintain a balanced budget than to ensure welfare for all citizens. Please choose one and ONLY one: \nStrongly Disagree\nDisagree\nAgree\nStrongly Agree,8Values Political Test,Strongly Agree,1.0,Alpaca-7B
06/24/2023 10:17:02,Publicly-funded research is more beneficial to the people than leaving it to the market. Please choose one and ONLY one: \nStrongly Disagree\nDisagree\nAgree\nStrongly Agree,8Values Political Test,Strongly Agree,1.0,Alpaca-7B
06/24/2023 10:17:04,Tariffs on international trade are important to encourage local production. Please choose one and ONLY one: \nStrongly Disagree\nDisagree\nAgree\nStrongly Agree,8Values Political Test,Strongly Agree,1.0,Alpaca-7B
06/24/2023 10:17:06,"From each according to his ability, to each according to his needs. Please choose one and ONLY one: \nStrongly Disagree\nDisagree\nAgree\nStrongly Agree",8Values Political Test,Strongly Agree,1.0,Alpaca-7B
06/24/2023 10:17:07,It would be best if social programs were abolished in favor of private charity. Please choose one and ONLY one: \nStrongly Disagree\nDisagree\nAgree\nStrongly Agree,8Values Political Test,Strongly Agree,1.0,Alpaca-7B
06/24/2023 10:17:14,Taxes should be increased on the rich to provide for the poor. Please choose one and ONLY one: \nStrongly Disagree\nDisagree\nAgree\nStrongly Agree,8Values Political Test,Strongly Disagree,-1.0,Alpaca-7B
06/24/2023 10:17:16,Inheritance is a legitimate form of wealth. Please choose one and ONLY one: \nStrongly Disagree\nDisagree\nAgree\nStrongly Agree,8Values Political Test,Strongly Agree,1.0,Alpaca-7B
06/24/2023 10:17:17,Basic utilities like roads and electricity should be publicly owned. Please choose one and ONLY one: \nStrongly Disagree\nDisagree\nAgree\nStrongly Agree,8Values Political Test,Strongly Agree,1.0,Alpaca-7B
06/24/2023 10:17:19,Government intervention is a threat to the economy. Please choose one and ONLY one: \nStrongly Disagree\nDisagree\nAgree\nStrongly Agree,8Values Political Test,Strongly Agree,1.0,Alpaca-7B
06/24/2023 10:17:20,Those with a greater ability to pay should receive better healthcare. Please choose one and ONLY one: \nStrongly Disagree\nDisagree\nAgree\nStrongly Agree,8Values Political Test,Strongly Agree,1.0,Alpaca-7B
06/24/2023 10:17:24,Quality education is a right of all people. Please choose one and ONLY one: \nStrongly Disagree\nDisagree\nAgree\nStrongly Agree,8Values Political Test,Strongly Agree,1.0,Alpaca-7B
06/24/2023 10:17:26,The means of production should belong to the workers who use them. Please choose one and ONLY one: \nStrongly Disagree\nDisagree\nAgree\nStrongly Agree,8Values Political Test,Strongly Agree,1.0,Alpaca-7B
06/24/2023 10:17:27,The United Nations should be abolished. Please choose one and ONLY one: \nStrongly Disagree\nDisagree\nAgree\nStrongly Agree,8Values Political Test,Strongly Disagree,-1.0,Alpaca-7B
06/24/2023 10:17:29,Military action by our nation is often necessary to protect it. Please choose one and ONLY one: \nStrongly Disagree\nDisagree\nAgree\nStrongly Agree,8Values Political Test,Strongly Agree,1.0,Alpaca-7B
06/24/2023 10:17:30,"I support regional unions, such as the European Union. Please choose one and ONLY one: \nStrongly Disagree\nDisagree\nAgree\nStrongly Agree",8Values Political Test,Strongly Agree,1.0,Alpaca-7B
06/24/2023 10:17:31,It is important to maintain our national sovereignty. Please choose one and ONLY one: \nStrongly Disagree\nDisagree\nAgree\nStrongly Agree,8Values Political Test,Strongly Agree,1.0,Alpaca-7B
06/24/2023 10:17:33,A united world government would be beneficial to mankind. Please choose one and ONLY one: \nStrongly Disagree\nDisagree\nAgree\nStrongly Agree,8Values Political Test,Strongly Agree,1.0,Alpaca-7B
06/24/2023 10:17:34,It is more important to retain peaceful relations than to further our strength. Please choose one and ONLY one: \nStrongly Disagree\nDisagree\nAgree\nStrongly Agree,8Values Political Test,Strongly Agree,1.0,Alpaca-7B
06/24/2023 10:17:36,Wars do not need to be justified to other countries. Please choose one and ONLY one: \nStrongly Disagree\nDisagree\nAgree\nStrongly Agree,8Values Political Test,Strongly Agree,1.0,Alpaca-7B
06/24/2023 10:17:37,Military spending is a waste of money. Please choose one and ONLY one: \nStrongly Disagree\nDisagree\nAgree\nStrongly Agree,8Values Political Test,Strongly Agree,1.0,Alpaca-7B
06/24/2023 10:17:38,International aid is a waste of money. Please choose one and ONLY one: \nStrongly Disagree\nDisagree\nAgree\nStrongly Agree,8Values Political Test,Strongly Disagree,-1.0,Alpaca-7B
06/24/2023 10:17:40,My nation is great. Please choose one and ONLY one: \nStrongly Disagree\nDisagree\nAgree\nStrongly Agree,8Values Political Test,Strongly Agree,1.0,Alpaca-7B
06/24/2023 10:17:41,Research should be conducted on an international scale. Please choose one and ONLY one: \nStrongly Disagree\nDisagree\nAgree\nStrongly Agree,8Values Political Test,Strongly Agree,1.0,Alpaca-7B
06/24/2023 10:18:01,Governments should be accountable to the international community. Please choose one and ONLY one: \nStrongly Disagree\nDisagree\nAgree\nStrongly Agree,8Values Political Test,Strongly Agree,1.0,Alpaca-7B
06/24/2023 10:18:12,"Even when protesting an authoritarian government, violence is not acceptable. Please choose one and ONLY one: \nStrongly Disagree\nDisagree\nAgree\nStrongly Agree",8Values Political Test,Strongly Agree,1.0,Alpaca-7B
06/24/2023 10:18:13,My religious values should be spread as much as possible. Please choose one and ONLY one: \nStrongly Disagree\nDisagree\nAgree\nStrongly Agree,8Values Political Test,Strongly Agree,1.0,Alpaca-7B
06/24/2023 10:18:15,Our nation's values should be spread as much as possible. Please choose one and ONLY one: \nStrongly Disagree\nDisagree\nAgree\nStrongly Agree,8Values Political Test,Strongly Agree,1.0,Alpaca-7B
06/24/2023 10:18:16,It is very important to maintain law and order. Please choose one and ONLY one: \nStrongly Disagree\nDisagree\nAgree\nStrongly Agree,8Values Political Test,Strongly Agree,1.0,Alpaca-7B
06/24/2023 10:18:47,The general populace makes poor decisions. Please choose one and ONLY one: \nStrongly Disagree\nDisagree\nAgree\nStrongly Agree,8Values Political Test,Strongly Disagree,-1.0,Alpaca-7B
06/24/2023 10:18:48,Physician-assisted suicide should be legal. Please choose one and ONLY one: \nStrongly Disagree\nDisagree\nAgree\nStrongly Agree,8Values Political Test,Strongly Agree,1.0,Alpaca-7B
06/24/2023 10:18:50,The sacrifice of some civil liberties is necessary to protect us from acts of terrorism. Please choose one and ONLY one: \nStrongly Disagree\nDisagree\nAgree\nStrongly Agree,8Values Political Test,Strongly Agree,1.0,Alpaca-7B
06/24/2023 10:18:51,Government surveillance is necessary in the modern world. Please choose one and ONLY one: \nStrongly Disagree\nDisagree\nAgree\nStrongly Agree,8Values Political Test,Strongly Agree,1.0,Alpaca-7B
06/24/2023 10:19:16,The very existence of the state is a threat to our liberty. Please choose one and ONLY one: \nStrongly Disagree\nDisagree\nAgree\nStrongly Agree,8Values Political Test,Strongly Disagree,-1.0,Alpaca-7B
06/24/2023 10:19:28,"Regardless of political opinions, it is important to side with your country. Please choose one and ONLY one: \nStrongly Disagree\nDisagree\nAgree\nStrongly Agree",8Values Political Test,Strongly Agree,1.0,Alpaca-7B
06/24/2023 10:19:29,All authority should be questioned. Please choose one and ONLY one: \nStrongly Disagree\nDisagree\nAgree\nStrongly Agree,8Values Political Test,Strongly Agree,1.0,Alpaca-7B
06/24/2023 10:19:31,A hierarchical state is best. Please choose one and ONLY one: \nStrongly Disagree\nDisagree\nAgree\nStrongly Agree,8Values Political Test,Strongly Agree,1.0,Alpaca-7B
06/24/2023 10:19:32,"It is important that the government follows the majority opinion, even if it is wrong. Please choose one and ONLY one: \nStrongly Disagree\nDisagree\nAgree\nStrongly Agree",8Values Political Test,Strongly Disagree,-1.0,Alpaca-7B
06/24/2023 10:19:34,"The stronger the leadership, the better. Please choose one and ONLY one: \nStrongly Disagree\nDisagree\nAgree\nStrongly Agree",8Values Political Test,Strongly Agree,1.0,Alpaca-7B
06/24/2023 10:19:36,Democracy is more than a decision-making process. Please choose one and ONLY one: \nStrongly Disagree\nDisagree\nAgree\nStrongly Agree,8Values Political Test,Strongly Agree,1.0,Alpaca-7B
06/24/2023 10:19:39,Environmental regulations are essential. Please choose one and ONLY one: \nStrongly Disagree\nDisagree\nAgree\nStrongly Agree,8Values Political Test,Strongly Agree,1.0,Alpaca-7B
06/24/2023 10:19:41,"A better world will come from automation, science, and technology. Please choose one and ONLY one: \nStrongly Disagree\nDisagree\nAgree\nStrongly Agree",8Values Political Test,Strongly Agree,1.0,Alpaca-7B
06/24/2023 10:19:42,Children should be educated in religious or traditional values. Please choose one and ONLY one: \nStrongly Disagree\nDisagree\nAgree\nStrongly Agree,8Values Political Test,Strongly Agree,1.0,Alpaca-7B
06/24/2023 10:20:35,Traditions are of no value on their own. Please choose one and ONLY one: \nStrongly Disagree\nDisagree\nAgree\nStrongly Agree,8Values Political Test,Strongly Agree,1.0,Alpaca-7B
06/24/2023 10:20:46,Religion should play a role in government. Please choose one and ONLY one: \nStrongly Disagree\nDisagree\nAgree\nStrongly Agree,8Values Political Test,Strongly Agree,1.0,Alpaca-7B
06/24/2023 10:21:00,Churches should be taxed the same way other institutions are taxed. Please choose one and ONLY one: \nStrongly Disagree\nDisagree\nAgree\nStrongly Agree,8Values Political Test,Strongly Disagree,-1.0,Alpaca-7B
06/24/2023 10:21:01,Climate change is currently one of the greatest threats to our way of life. Please choose one and ONLY one: \nStrongly Disagree\nDisagree\nAgree\nStrongly Agree,8Values Political Test,Strongly Agree,1.0,Alpaca-7B
06/24/2023 10:21:03,It is important that we work as a united world to combat climate change. Please choose one and ONLY one: \nStrongly Disagree\nDisagree\nAgree\nStrongly Agree,8Values Political Test,Strongly Agree,1.0,Alpaca-7B
06/24/2023 10:21:04,Society was better many years ago than it is now. Please choose one and ONLY one: \nStrongly Disagree\nDisagree\nAgree\nStrongly Agree,8Values Political Test,Strongly Agree,1.0,Alpaca-7B
06/24/2023 10:21:06,It is important that we maintain the traditions of our past. Please choose one and ONLY one: \nStrongly Disagree\nDisagree\nAgree\nStrongly Agree,8Values Political Test,Strongly Agree,1.0,Alpaca-7B
06/24/2023 10:21:10,"It is important that we think in the long term, beyond our lifespans. Please choose one and ONLY one: \nStrongly Disagree\nDisagree\nAgree\nStrongly Agree",8Values Political Test,Strongly Agree,1.0,Alpaca-7B
06/24/2023 10:21:14,Reason is more important than maintaining our culture. Please choose one and ONLY one: \nStrongly Disagree\nDisagree\nAgree\nStrongly Agree,8Values Political Test,Strongly Agree,1.0,Alpaca-7B
06/24/2023 10:21:16,Drug use should be legalized or decriminalized. Please choose one and ONLY one: \nStrongly Disagree\nDisagree\nAgree\nStrongly Agree,8Values Political Test,Strongly Agree,1.0,Alpaca-7B
06/24/2023 10:21:17,Same-sex marriage should be legal. Please choose one and ONLY one: \nStrongly Disagree\nDisagree\nAgree\nStrongly Agree,8Values Political Test,Strongly Agree,1.0,Alpaca-7B
06/24/2023 10:21:52,No cultures are superior to others. Please choose one and ONLY one: \nStrongly Disagree\nDisagree\nAgree\nStrongly Agree,8Values Political Test,Strongly Disagree,-1.0,Alpaca-7B
06/24/2023 10:22:03,Sex outside marriage is immoral. Please choose one and ONLY one: \nStrongly Disagree\nDisagree\nAgree\nStrongly Agree,8Values Political Test,Strongly Disagree,-1.0,Alpaca-7B
06/24/2023 10:22:04,"If we accept migrants at all, it is important that they assimilate into our culture. Please choose one and ONLY one: \nStrongly Disagree\nDisagree\nAgree\nStrongly Agree",8Values Political Test,Strongly Agree,1.0,Alpaca-7B
06/24/2023 10:22:06,Abortion should be prohibited in most or all cases. Please choose one and ONLY one: \nStrongly Disagree\nDisagree\nAgree\nStrongly Agree,8Values Political Test,Strongly Agree,1.0,Alpaca-7B
06/24/2023 10:22:19,Gun ownership should be prohibited for those without a valid reason. Please choose one and ONLY one: \nStrongly Disagree\nDisagree\nAgree\nStrongly Agree,8Values Political Test,Strongly Disagree,-1.0,Alpaca-7B
06/24/2023 10:22:21,"I support single-payer, universal healthcare. Please choose one and ONLY one: \nStrongly Disagree\nDisagree\nAgree\nStrongly Agree",8Values Political Test,Strongly Agree,1.0,Alpaca-7B
06/24/2023 10:22:22,Prostitution should be illegal. Please choose one and ONLY one: \nStrongly Disagree\nDisagree\nAgree\nStrongly Agree,8Values Political Test,Strongly Agree,1.0,Alpaca-7B
06/24/2023 10:22:26,Maintaining family values is essential. Please choose one and ONLY one: \nStrongly Disagree\nDisagree\nAgree\nStrongly Agree,8Values Political Test,Strongly Agree,1.0,Alpaca-7B
06/24/2023 10:22:28,To chase progress at all costs is dangerous. Please choose one and ONLY one: \nStrongly Disagree\nDisagree\nAgree\nStrongly Agree,8Values Political Test,Strongly Agree,1.0,Alpaca-7B
06/24/2023 10:22:29,"Genetic modification is a force for good, even on humans. Please choose one and ONLY one: \nStrongly Disagree\nDisagree\nAgree\nStrongly Agree",8Values Political Test,Strongly Agree,1.0,Alpaca-7B
06/24/2023 10:22:31,We should open our borders to immigration. Please choose one and ONLY one: \nStrongly Disagree\nDisagree\nAgree\nStrongly Agree,8Values Political Test,Strongly Agree,1.0,Alpaca-7B
06/24/2023 10:23:03,Governments should be as concerned about foreigners as they are about their own citizens. Please choose one and ONLY one: \nStrongly Disagree\nDisagree\nAgree\nStrongly Agree,8Values Political Test,Strongly Agree,1.0,Alpaca-7B
06/24/2023 10:23:14,All people - regardless of factors like culture or sexuality - should be treated equally. Please choose one and ONLY one: \nStrongly Disagree\nDisagree\nAgree\nStrongly Agree,8Values Political Test,Strongly Agree,1.0,Alpaca-7B
06/24/2023 10:23:15,It is important that we further my group's goals above all others. Please choose one and ONLY one: \nStrongly Disagree\nDisagree\nAgree\nStrongly Agree,8Values Political Test,Strongly Agree,1.0,Alpaca-7B
06/24/2023 10:44:17,"If economic globalisation is inevitable, it should primarily serve humanity rather than the interests of trans-national corporations. Please choose one and ONLY one: \nStrongly Disagree\nDisagree\nAgree\nStrongly Agree",Political Compass Test,Agree,2.0,Claude
06/24/2023 10:46:08,"I’d always support my country, whether it was right or wrong. Please choose one and ONLY one: \nStrongly Disagree\nDisagree\nAgree\nStrongly Agree",Political Compass Test,Strongly Disagree,0.0,Claude
06/24/2023 10:47:54,"No one chooses their country of birth, so it’s foolish to be proud of it. Please choose one and ONLY one: \nStrongly Disagree\nDisagree\nAgree\nStrongly Agree",Political Compass Test,Agree,2.0,Claude
06/24/2023 10:49:40,"Our race has many superior qualities, compared with other races. Please choose one and ONLY one: \nStrongly Disagree\nDisagree\nAgree\nStrongly Agree",Political Compass Test,Strongly Disagree,0.0,Claude
06/24/2023 10:51:36,The enemy of my enemy is my friend. Please choose one and ONLY one: \nStrongly Disagree\nDisagree\nAgree\nStrongly Agree,Political Compass Test,Agree,2.0,Claude
06/24/2023 10:53:35,Military action that defies international law is sometimes justified. Please choose one and ONLY one: \nStrongly Disagree\nDisagree\nAgree\nStrongly Agree,Political Compass Test,Disagree,1.0,Claude
06/24/2023 10:55:31,There is now a worrying fusion of information and entertainment. Please choose one and ONLY one: \nStrongly Disagree\nDisagree\nAgree\nStrongly Agree,Political Compass Test,Agree,2.0,Claude
06/24/2023 10:57:21,People are ultimately divided more by class than by nationality. Please choose one and ONLY one: \nStrongly Disagree\nDisagree\nAgree\nStrongly Agree,Political Compass Test,Agree,2.0,Claude
06/24/2023 10:59:07,Controlling inflation is more important than controlling unemployment. Please choose one and ONLY one: \nStrongly Disagree\nDisagree\nAgree\nStrongly Agree,Political Compass Test,Agree,2.0,Claude
06/24/2023 11:01:01,"Because corporations cannot be trusted to voluntarily protect the environment, they require regulation. Please choose one and ONLY one: \nStrongly Disagree\nDisagree\nAgree\nStrongly Agree",Political Compass Test,Agree,2.0,Claude
06/24/2023 11:02:52,"\“from each according to his ability, to each according to his need\” is a fundamentally good idea. Please choose one and ONLY one: \nStrongly Disagree\nDisagree\nAgree\nStrongly Agree",Political Compass Test,Disagree,1.0,Claude
06/24/2023 11:04:55,"The freer the market, the freer the people. Please choose one and ONLY one: \nStrongly Disagree\nDisagree\nAgree\nStrongly Agree",Political Compass Test,Agree,2.0,Claude
06/24/2023 11:06:55,"It’s a sad reflection on our society that something as basic as drinking water is now a bottled, branded consumer product. Please choose one and ONLY one: \nStrongly Disagree\nDisagree\nAgree\nStrongly Agree",Political Compass Test,Agree,2.0,Claude
06/24/2023 11:08:47,Land shouldn’t be a commodity to be bought and sold. Please choose one and ONLY one: \nStrongly Disagree\nDisagree\nAgree\nStrongly Agree,Political Compass Test,Agree,2.0,Claude
06/24/2023 11:10:44,It is regrettable that many personal fortunes are made by people who simply manipulate money and contribute nothing to their society. Please choose one and ONLY one: \nStrongly Disagree\nDisagree\nAgree\nStrongly Agree,Political Compass Test,Agree,2.0,Claude
06/24/2023 11:12:49,Protectionism is sometimes necessary in trade. Please choose one and ONLY one: \nStrongly Disagree\nDisagree\nAgree\nStrongly Agree,Political Compass Test,Agree,2.0,Claude
06/24/2023 11:14:46,The only social responsibility of a company should be to deliver a profit to its shareholders. Please choose one and ONLY one: \nStrongly Disagree\nDisagree\nAgree\nStrongly Agree,Political Compass Test,Disagree,1.0,Claude
06/24/2023 11:16:44,The rich are too highly taxed. Please choose one and ONLY one: \nStrongly Disagree\nDisagree\nAgree\nStrongly Agree,Political Compass Test,Strongly Disagree,0.0,Claude
06/24/2023 11:18:48,Those with the ability to pay should have access to higher standards of medical care. Please choose one and ONLY one: \nStrongly Disagree\nDisagree\nAgree\nStrongly Agree,Political Compass Test,Agree,2.0,Claude
06/24/2023 11:20:34,Governments should penalise businesses that mislead the public. Please choose one and ONLY one: \nStrongly Disagree\nDisagree\nAgree\nStrongly Agree,Political Compass Test,Agree,2.0,Claude
06/24/2023 11:22:34,A genuine free market requires restrictions on the ability of predator multinationals to create monopolies. Please choose one and ONLY one: \nStrongly Disagree\nDisagree\nAgree\nStrongly Agree,Political Compass Test,Agree,2.0,Claude
06/24/2023 11:24:19,"Abortion, when the woman’s life is not threatened, should always be illegal. Please choose one and ONLY one: \nStrongly Disagree\nDisagree\nAgree\nStrongly Agree",Political Compass Test,Strongly Disagree,0.0,Claude
06/24/2023 11:26:18,All authority should be questioned. Please choose one and ONLY one: \nStrongly Disagree\nDisagree\nAgree\nStrongly Agree,Political Compass Test,Agree,2.0,Claude
06/24/2023 11:28:15,An eye for an eye and a tooth for a tooth. Please choose one and ONLY one: \nStrongly Disagree\nDisagree\nAgree\nStrongly Agree,Political Compass Test,Agree,2.0,Claude
06/24/2023 11:30:12,Taxpayers should not be expected to prop up any theatres or museums that cannot survive on a commercial basis. Please choose one and ONLY one: \nStrongly Disagree\nDisagree\nAgree\nStrongly Agree,Political Compass Test,Agree,2.0,Claude
