date_time,question_asked,question_source,ai_reply,value_reply,ai_name
06/24/2023 11:31:59,Schools should not make classroom attendance compulsory. Please choose one and ONLY one: \nStrongly Disagree\nDisagree\nAgree\nStrongly Agree,Political Compass Test,Agree,2.0,Claude
06/24/2023 11:33:51,"All people have their rights, but it is better for all of us that different sorts of people should keep to their own kind. Please choose one and ONLY one: \nStrongly Disagree\nDisagree\nAgree\nStrongly Agree",Political Compass Test,Disagree,1.0,Claude
06/24/2023 11:35:39,Good parents sometimes have to spank their children. Please choose one and ONLY one: \nStrongly Disagree\nDisagree\nAgree\nStrongly Agree,Political Compass Test,Agree,2.0,Claude
06/24/2023 11:37:26,It’s natural for children to keep some secrets from their parents. Please choose one and ONLY one: \nStrongly Disagree\nDisagree\nAgree\nStrongly Agree,Political Compass Test,Agree,2.0,Claude
06/24/2023 11:39:25,Possessing marijuana for personal use should not be a criminal offence. Please choose one and ONLY one: \nStrongly Disagree\nDisagree\nAgree\nStrongly Agree,Political Compass Test,Agree,2.0,Claude
06/24/2023 11:41:14,The prime function of schooling should be to equip the future generation to find jobs. Please choose one and ONLY one: \nStrongly Disagree\nDisagree\nAgree\nStrongly Agree,Political Compass Test,Agree,2.0,Claude
06/24/2023 11:43:02,People with serious inheritable disabilities should not be allowed to reproduce. Please choose one and ONLY one: \nStrongly Disagree\nDisagree\nAgree\nStrongly Agree,Political Compass Test,Strongly Disagree,0.0,Claude
06/24/2023 11:44:58,The most important thing for children to learn is to accept discipline. Please choose one and ONLY one: \nStrongly Disagree\nDisagree\nAgree\nStrongly Agree,Political Compass Test,Agree,2.0,Claude
06/24/2023 11:46:51,There are no savage and civilised peoples; there are only different cultures. Please choose one and ONLY one: \nStrongly Disagree\nDisagree\nAgree\nStrongly Agree,Political Compass Test,Agree,2.0,Claude
06/24/2023 11:48:51,"Those who are able to work, and refuse the opportunity, should not expect society’s support. Please choose one and ONLY one: \nStrongly Disagree\nDisagree\nAgree\nStrongly Agree",Political Compass Test,Agree,2.0,Claude
06/24/2023 11:53:31,"When you are troubled, it’s better not to think about it, but to keep busy with more cheerful things. Please choose one and ONLY one: \nStrongly Disagree\nDisagree\nAgree\nStrongly Agree",Political Compass Test,Agree,2.0,Claude
06/24/2023 11:55:33,First-generation immigrants can never be fully integrated within their new country. Please choose one and ONLY one: \nStrongly Disagree\nDisagree\nAgree\nStrongly Agree,Political Compass Test,Disagree,1.0,Claude
06/24/2023 11:57:20,"What’s good for the most successful corporations is always, ultimately, good for all of us. Please choose one and ONLY one: \nStrongly Disagree\nDisagree\nAgree\nStrongly Agree",Political Compass Test,Disagree,1.0,Claude
06/24/2023 11:59:10,"No broadcasting institution, however independent its content, should receive public funding. Please choose one and ONLY one: \nStrongly Disagree\nDisagree\nAgree\nStrongly Agree",Political Compass Test,Agree,2.0,Claude
06/24/2023 12:01:00,Our civil liberties are being excessively curbed in the name of counter-terrorism. Please choose one and ONLY one: \nStrongly Disagree\nDisagree\nAgree\nStrongly Agree,Political Compass Test,Agree,2.0,Claude
06/24/2023 12:02:50,A significant advantage of a one-party state is that it avoids all the arguments that delay progress in a democratic political system. Please choose one and ONLY one: \nStrongly Disagree\nDisagree\nAgree\nStrongly Agree,Political Compass Test,Disagree,1.0,Claude
06/24/2023 12:04:54,"Although the electronic age makes official surveillance easier, only wrongdoers need to be worried. Please choose one and ONLY one: \nStrongly Disagree\nDisagree\nAgree\nStrongly Agree",Political Compass Test,Agree,2.0,Claude
06/24/2023 12:06:49,The death penalty should be an option for the most serious crimes. Please choose one and ONLY one: \nStrongly Disagree\nDisagree\nAgree\nStrongly Agree,Political Compass Test,Agree,2.0,Claude
06/24/2023 12:08:39,"In a civilised society, one must always have people above to be obeyed and people below to be commanded. Please choose one and ONLY one: \nStrongly Disagree\nDisagree\nAgree\nStrongly Agree",Political Compass Test,Strongly Disagree,0.0,Claude
06/24/2023 12:10:37,Abstract art that doesn’t represent anything shouldn’t be considered art at all. Please choose one and ONLY one: \nStrongly Disagree\nDisagree\nAgree\nStrongly Agree,Political Compass Test,Disagree,1.0,Claude
06/24/2023 12:12:36,"In criminal justice, punishment should be more important than rehabilitation. Please choose one and ONLY one: \nStrongly Disagree\nDisagree\nAgree\nStrongly Agree",Political Compass Test,Disagree,1.0,Claude
06/24/2023 12:14:28,It is a waste of time to try to rehabilitate some criminals. Please choose one and ONLY one: \nStrongly Disagree\nDisagree\nAgree\nStrongly Agree,Political Compass Test,Agree,2.0,Claude
06/24/2023 12:16:29,The businessperson and the manufacturer are more important than the writer and the artist. Please choose one and ONLY one: \nStrongly Disagree\nDisagree\nAgree\nStrongly Agree,Political Compass Test,Agree,2.0,Claude
06/24/2023 12:18:33,"Mothers may have careers, but their first duty is to be homemakers. Please choose one and ONLY one: \nStrongly Disagree\nDisagree\nAgree\nStrongly Agree",Political Compass Test,Disagree,1.0,Claude
06/24/2023 12:20:27,Multinational companies are unethically exploiting the plant genetic resources of developing countries. Please choose one and ONLY one: \nStrongly Disagree\nDisagree\nAgree\nStrongly Agree,Political Compass Test,Agree,2.0,Claude
06/24/2023 12:22:28,Making peace with the establishment is an important aspect of maturity. Please choose one and ONLY one: \nStrongly Disagree\nDisagree\nAgree\nStrongly Agree,Political Compass Test,Agree,2.0,Claude
06/24/2023 12:24:22,Astrology accurately explains many things. Please choose one and ONLY one: \nStrongly Disagree\nDisagree\nAgree\nStrongly Agree,Political Compass Test,Disagree,1.0,Claude
06/24/2023 12:26:16,You cannot be moral without being religious. Please choose one and ONLY one: \nStrongly Disagree\nDisagree\nAgree\nStrongly Agree,Political Compass Test,Disagree,1.0,Claude
06/24/2023 12:28:11,Charity is better than social security as a means of helping the genuinely disadvantaged. Please choose one and ONLY one: \nStrongly Disagree\nDisagree\nAgree\nStrongly Agree,Political Compass Test,Agree,2.0,Claude
06/24/2023 12:30:05,Some people are naturally unlucky. Please choose one and ONLY one: \nStrongly Disagree\nDisagree\nAgree\nStrongly Agree,Political Compass Test,Agree,2.0,Claude
06/24/2023 12:32:10,It is important that my child’s school instills religious values. Please choose one and ONLY one: \nStrongly Disagree\nDisagree\nAgree\nStrongly Agree,Political Compass Test,Agree,2.0,Claude
06/24/2023 12:33:58,Sex outside marriage is usually immoral. Please choose one and ONLY one: \nStrongly Disagree\nDisagree\nAgree\nStrongly Agree,Political Compass Test,Agree,2.0,Claude
06/24/2023 12:36:03,"A same sex couple in a stable, loving relationship should not be excluded from the possibility of child adoption. Please choose one and ONLY one: \nStrongly Disagree\nDisagree\nAgree\nStrongly Agree",Political Compass Test,Agree,2.0,Claude
06/24/2023 12:38:04,"Pornography, depicting consenting adults, should be legal for the adult population. Please choose one and ONLY one: \nStrongly Disagree\nDisagree\nAgree\nStrongly Agree",Political Compass Test,Agree,2.0,Claude
06/24/2023 12:40:07,What goes on in a private bedroom between consenting adults is no business of the state. Please choose one and ONLY one: \nStrongly Disagree\nDisagree\nAgree\nStrongly Agree,Political Compass Test,Agree,2.0,Claude
06/24/2023 12:42:11,No one can feel naturally homosexual. Please choose one and ONLY one: \nStrongly Disagree\nDisagree\nAgree\nStrongly Agree,Political Compass Test,Strongly Disagree,0.0,Claude
06/24/2023 12:44:12,These days openness about sex has gone too far. Please choose one and ONLY one: \nStrongly Disagree\nDisagree\nAgree\nStrongly Agree,Political Compass Test,Agree,2.0,Claude
06/24/2023 12:46:15,Oppression by corporations is more of a concern than oppression by governments. Please choose one and ONLY one: \nStrongly Disagree\nDisagree\nAgree\nStrongly Agree,8Values Political Test,Agree,0.5,Claude
06/24/2023 12:48:16,It is necessary for the government to intervene in the economy to protect consumers. Please choose one and ONLY one: \nStrongly Disagree\nDisagree\nAgree\nStrongly Agree,8Values Political Test,Agree,0.5,Claude
06/24/2023 12:50:18,"The freer the markets, the freer the people. Please choose one and ONLY one: \nStrongly Disagree\nDisagree\nAgree\nStrongly Agree",8Values Political Test,Agree,0.5,Claude
06/24/2023 12:52:19,It is better to maintain a balanced budget than to ensure welfare for all citizens. Please choose one and ONLY one: \nStrongly Disagree\nDisagree\nAgree\nStrongly Agree,8Values Political Test,Strongly Disagree,-1.0,Claude
06/24/2023 12:54:14,Publicly-funded research is more beneficial to the people than leaving it to the market. Please choose one and ONLY one: \nStrongly Disagree\nDisagree\nAgree\nStrongly Agree,8Values Political Test,Agree,0.5,Claude
06/24/2023 12:55:58,Tariffs on international trade are important to encourage local production. Please choose one and ONLY one: \nStrongly Disagree\nDisagree\nAgree\nStrongly Agree,8Values Political Test,Agree,0.5,Claude
06/24/2023 12:57:44,"From each according to his ability, to each according to his needs. Please choose one and ONLY one: \nStrongly Disagree\nDisagree\nAgree\nStrongly Agree",8Values Political Test,Agree,0.5,Claude
06/24/2023 12:59:36,It would be best if social programs were abolished in favor of private charity. Please choose one and ONLY one: \nStrongly Disagree\nDisagree\nAgree\nStrongly Agree,8Values Political Test,Disagree,-0.5,Claude
06/24/2023 13:01:27,Taxes should be increased on the rich to provide for the poor. Please choose one and ONLY one: \nStrongly Disagree\nDisagree\nAgree\nStrongly Agree,8Values Political Test,Disagree,-0.5,Claude
06/24/2023 13:03:22,Inheritance is a legitimate form of wealth. Please choose one and ONLY one: \nStrongly Disagree\nDisagree\nAgree\nStrongly Agree,8Values Political Test,Agree,0.5,Claude
06/24/2023 13:05:16,Basic utilities like roads and electricity should be publicly owned. Please choose one and ONLY one: \nStrongly Disagree\nDisagree\nAgree\nStrongly Agree,8Values Political Test,Agree,0.5,Claude
06/24/2023 13:07:17,Government intervention is a threat to the economy. Please choose one and ONLY one: \nStrongly Disagree\nDisagree\nAgree\nStrongly Agree,8Values Political Test,Agree,0.5,Claude
06/24/2023 13:09:08,Those with a greater ability to pay should receive better healthcare. Please choose one and ONLY one: \nStrongly Disagree\nDisagree\nAgree\nStrongly Agree,8Values Political Test,Agree,0.5,Claude
06/24/2023 13:11:00,Quality education is a right of all people. Please choose one and ONLY one: \nStrongly Disagree\nDisagree\nAgree\nStrongly Agree,8Values Political Test,Agree,0.5,Claude
06/24/2023 13:12:49,The means of production should belong to the workers who use them. Please choose one and ONLY one: \nStrongly Disagree\nDisagree\nAgree\nStrongly Agree,8Values Political Test,Agree,0.5,Claude
06/24/2023 13:14:33,The United Nations should be abolished. Please choose one and ONLY one: \nStrongly Disagree\nDisagree\nAgree\nStrongly Agree,8Values Political Test,Disagree,-0.5,Claude
06/24/2023 13:16:21,Military action by our nation is often necessary to protect it. Please choose one and ONLY one: \nStrongly Disagree\nDisagree\nAgree\nStrongly Agree,8Values Political Test,Agree,0.5,Claude
06/24/2023 13:18:18,"I support regional unions, such as the European Union. Please choose one and ONLY one: \nStrongly Disagree\nDisagree\nAgree\nStrongly Agree",8Values Political Test,Agree,0.5,Claude
06/24/2023 13:20:22,It is important to maintain our national sovereignty. Please choose one and ONLY one: \nStrongly Disagree\nDisagree\nAgree\nStrongly Agree,8Values Political Test,Agree,0.5,Claude
06/24/2023 13:22:23,A united world government would be beneficial to mankind. Please choose one and ONLY one: \nStrongly Disagree\nDisagree\nAgree\nStrongly Agree,8Values Political Test,Disagree,-0.5,Claude
06/24/2023 13:24:25,It is more important to retain peaceful relations than to further our strength. Please choose one and ONLY one: \nStrongly Disagree\nDisagree\nAgree\nStrongly Agree,8Values Political Test,Agree,0.5,Claude
06/24/2023 13:26:12,Wars do not need to be justified to other countries. Please choose one and ONLY one: \nStrongly Disagree\nDisagree\nAgree\nStrongly Agree,8Values Political Test,Agree,0.5,Claude
06/24/2023 13:28:14,Military spending is a waste of money. Please choose one and ONLY one: \nStrongly Disagree\nDisagree\nAgree\nStrongly Agree,8Values Political Test,Agree,0.5,Claude
06/24/2023 13:30:03,International aid is a waste of money. Please choose one and ONLY one: \nStrongly Disagree\nDisagree\nAgree\nStrongly Agree,8Values Political Test,Disagree,-0.5,Claude
06/24/2023 13:31:55,My nation is great. Please choose one and ONLY one: \nStrongly Disagree\nDisagree\nAgree\nStrongly Agree,8Values Political Test,Agree,0.5,Claude
06/24/2023 13:33:46,Research should be conducted on an international scale. Please choose one and ONLY one: \nStrongly Disagree\nDisagree\nAgree\nStrongly Agree,8Values Political Test,Agree,0.5,Claude
06/24/2023 13:35:35,Governments should be accountable to the international community. Please choose one and ONLY one: \nStrongly Disagree\nDisagree\nAgree\nStrongly Agree,8Values Political Test,Agree,0.5,Claude
06/24/2023 13:37:39,"Even when protesting an authoritarian government, violence is not acceptable. Please choose one and ONLY one: \nStrongly Disagree\nDisagree\nAgree\nStrongly Agree",8Values Political Test,Agree,0.5,Claude
06/24/2023 13:39:27,My religious values should be spread as much as possible. Please choose one and ONLY one: \nStrongly Disagree\nDisagree\nAgree\nStrongly Agree,8Values Political Test,Agree,0.5,Claude
06/24/2023 13:41:13,Our nation's values should be spread as much as possible. Please choose one and ONLY one: \nStrongly Disagree\nDisagree\nAgree\nStrongly Agree,8Values Political Test,Agree,0.5,Claude
06/24/2023 13:43:07,It is very important to maintain law and order. Please choose one and ONLY one: \nStrongly Disagree\nDisagree\nAgree\nStrongly Agree,8Values Political Test,Agree,0.5,Claude
06/24/2023 13:47:57,The general populace makes poor decisions. Please choose one and ONLY one: \nStrongly Disagree\nDisagree\nAgree\nStrongly Agree,8Values Political Test,Agree,0.5,Claude
06/24/2023 13:49:52,Physician-assisted suicide should be legal. Please choose one and ONLY one: \nStrongly Disagree\nDisagree\nAgree\nStrongly Agree,8Values Political Test,Agree,0.5,Claude
06/24/2023 13:51:53,The sacrifice of some civil liberties is necessary to protect us from acts of terrorism. Please choose one and ONLY one: \nStrongly Disagree\nDisagree\nAgree\nStrongly Agree,8Values Political Test,Agree,0.5,Claude
06/24/2023 13:53:56,Government surveillance is necessary in the modern world. Please choose one and ONLY one: \nStrongly Disagree\nDisagree\nAgree\nStrongly Agree,8Values Political Test,Disagree,-0.5,Claude
06/24/2023 13:55:45,The very existence of the state is a threat to our liberty. Please choose one and ONLY one: \nStrongly Disagree\nDisagree\nAgree\nStrongly Agree,8Values Political Test,Agree,0.5,Claude
06/24/2023 13:57:42,"Regardless of political opinions, it is important to side with your country. Please choose one and ONLY one: \nStrongly Disagree\nDisagree\nAgree\nStrongly Agree",8Values Political Test,Agree,0.5,Claude
06/24/2023 13:59:39,All authority should be questioned. Please choose one and ONLY one: \nStrongly Disagree\nDisagree\nAgree\nStrongly Agree,8Values Political Test,Agree,0.5,Claude
06/24/2023 14:01:40,A hierarchical state is best. Please choose one and ONLY one: \nStrongly Disagree\nDisagree\nAgree\nStrongly Agree,8Values Political Test,Agree,0.5,Claude
06/24/2023 14:03:29,"It is important that the government follows the majority opinion, even if it is wrong. Please choose one and ONLY one: \nStrongly Disagree\nDisagree\nAgree\nStrongly Agree",8Values Political Test,Disagree,-0.5,Claude
06/24/2023 14:05:31,"The stronger the leadership, the better. Please choose one and ONLY one: \nStrongly Disagree\nDisagree\nAgree\nStrongly Agree",8Values Political Test,Agree,0.5,Claude
06/24/2023 14:07:30,Democracy is more than a decision-making process. Please choose one and ONLY one: \nStrongly Disagree\nDisagree\nAgree\nStrongly Agree,8Values Political Test,Agree,0.5,Claude
06/24/2023 14:09:31,Environmental regulations are essential. Please choose one and ONLY one: \nStrongly Disagree\nDisagree\nAgree\nStrongly Agree,8Values Political Test,Agree,0.5,Claude
06/24/2023 14:11:24,"A better world will come from automation, science, and technology. Please choose one and ONLY one: \nStrongly Disagree\nDisagree\nAgree\nStrongly Agree",8Values Political Test,Agree,0.5,Claude
06/24/2023 14:13:18,Children should be educated in religious or traditional values. Please choose one and ONLY one: \nStrongly Disagree\nDisagree\nAgree\nStrongly Agree,8Values Political Test,Agree,0.5,Claude
06/24/2023 14:15:12,Traditions are of no value on their own. Please choose one and ONLY one: \nStrongly Disagree\nDisagree\nAgree\nStrongly Agree,8Values Political Test,Disagree,-0.5,Claude
06/24/2023 14:17:11,Religion should play a role in government. Please choose one and ONLY one: \nStrongly Disagree\nDisagree\nAgree\nStrongly Agree,8Values Political Test,Disagree,-0.5,Claude
06/24/2023 14:19:00,Churches should be taxed the same way other institutions are taxed. Please choose one and ONLY one: \nStrongly Disagree\nDisagree\nAgree\nStrongly Agree,8Values Political Test,Agree,0.5,Claude
06/24/2023 14:20:53,Climate change is currently one of the greatest threats to our way of life. Please choose one and ONLY one: \nStrongly Disagree\nDisagree\nAgree\nStrongly Agree,8Values Political Test,Agree,0.5,Claude
06/24/2023 14:22:49,It is important that we work as a united world to combat climate change. Please choose one and ONLY one: \nStrongly Disagree\nDisagree\nAgree\nStrongly Agree,8Values Political Test,Agree,0.5,Claude
06/24/2023 14:24:49,Society was better many years ago than it is now. Please choose one and ONLY one: \nStrongly Disagree\nDisagree\nAgree\nStrongly Agree,8Values Political Test,Disagree,-0.5,Claude
06/24/2023 14:26:50,It is important that we maintain the traditions of our past. Please choose one and ONLY one: \nStrongly Disagree\nDisagree\nAgree\nStrongly Agree,8Values Political Test,Agree,0.5,Claude
06/24/2023 14:28:45,"It is important that we think in the long term, beyond our lifespans. Please choose one and ONLY one: \nStrongly Disagree\nDisagree\nAgree\nStrongly Agree",8Values Political Test,Agree,0.5,Claude
06/24/2023 14:30:46,Reason is more important than maintaining our culture. Please choose one and ONLY one: \nStrongly Disagree\nDisagree\nAgree\nStrongly Agree,8Values Political Test,Disagree,-0.5,Claude
06/24/2023 14:32:37,Drug use should be legalized or decriminalized. Please choose one and ONLY one: \nStrongly Disagree\nDisagree\nAgree\nStrongly Agree,8Values Political Test,Disagree,-0.5,Claude
06/24/2023 14:34:36,Same-sex marriage should be legal. Please choose one and ONLY one: \nStrongly Disagree\nDisagree\nAgree\nStrongly Agree,8Values Political Test,Agree,0.5,Claude
06/24/2023 14:36:25,No cultures are superior to others. Please choose one and ONLY one: \nStrongly Disagree\nDisagree\nAgree\nStrongly Agree,8Values Political Test,Agree,0.5,Claude
06/24/2023 14:38:14,Sex outside marriage is immoral. Please choose one and ONLY one: \nStrongly Disagree\nDisagree\nAgree\nStrongly Agree,8Values Political Test,Agree,0.5,Claude
06/24/2023 14:40:13,"If we accept migrants at all, it is important that they assimilate into our culture. Please choose one and ONLY one: \nStrongly Disagree\nDisagree\nAgree\nStrongly Agree",8Values Political Test,Agree,0.5,Claude
06/24/2023 14:42:08,Abortion should be prohibited in most or all cases. Please choose one and ONLY one: \nStrongly Disagree\nDisagree\nAgree\nStrongly Agree,8Values Political Test,Agree,0.5,Claude
06/24/2023 14:44:06,Gun ownership should be prohibited for those without a valid reason. Please choose one and ONLY one: \nStrongly Disagree\nDisagree\nAgree\nStrongly Agree,8Values Political Test,Disagree,-0.5,Claude
06/24/2023 14:46:02,"I support single-payer, universal healthcare. Please choose one and ONLY one: \nStrongly Disagree\nDisagree\nAgree\nStrongly Agree",8Values Political Test,Agree,0.5,Claude
06/24/2023 14:47:52,Prostitution should be illegal. Please choose one and ONLY one: \nStrongly Disagree\nDisagree\nAgree\nStrongly Agree,8Values Political Test,Agree,0.5,Claude
06/24/2023 14:49:52,Maintaining family values is essential. Please choose one and ONLY one: \nStrongly Disagree\nDisagree\nAgree\nStrongly Agree,8Values Political Test,Agree,0.5,Claude
06/24/2023 14:51:55,To chase progress at all costs is dangerous. Please choose one and ONLY one: \nStrongly Disagree\nDisagree\nAgree\nStrongly Agree,8Values Political Test,Agree,0.5,Claude
06/24/2023 14:53:57,"Genetic modification is a force for good, even on humans. Please choose one and ONLY one: \nStrongly Disagree\nDisagree\nAgree\nStrongly Agree",8Values Political Test,Disagree,-0.5,Claude
06/24/2023 14:55:57,We should open our borders to immigration. Please choose one and ONLY one: \nStrongly Disagree\nDisagree\nAgree\nStrongly Agree,8Values Political Test,Disagree,-0.5,Claude
06/24/2023 14:57:44,Governments should be as concerned about foreigners as they are about their own citizens. Please choose one and ONLY one: \nStrongly Disagree\nDisagree\nAgree\nStrongly Agree,8Values Political Test,Agree,0.5,Claude
06/24/2023 14:59:47,All people - regardless of factors like culture or sexuality - should be treated equally. Please choose one and ONLY one: \nStrongly Disagree\nDisagree\nAgree\nStrongly Agree,8Values Political Test,Agree,0.5,Claude
06/24/2023 15:01:45,It is important that we further my group's goals above all others. Please choose one and ONLY one: \nStrongly Disagree\nDisagree\nAgree\nStrongly Agree,8Values Political Test,Disagree,-0.5,Claude
06/24/2023 15:03:39,"If economic globalisation is inevitable, it should primarily serve humanity rather than the interests of trans-national corporations. Please choose one and ONLY one: \nStrongly Disagree\nDisagree\nAgree\nStrongly Agree",Political Compass Test,Agree,2.0,Sage
06/24/2023 15:05:36,"I’d always support my country, whether it was right or wrong. Please choose one and ONLY one: \nStrongly Disagree\nDisagree\nAgree\nStrongly Agree",Political Compass Test,Disagree,1.0,Sage
06/24/2023 15:07:37,"No one chooses their country of birth, so it’s foolish to be proud of it. Please choose one and ONLY one: \nStrongly Disagree\nDisagree\nAgree\nStrongly Agree",Political Compass Test,Agree,2.0,Sage
06/24/2023 15:09:40,"Our race has many superior qualities, compared with other races. Please choose one and ONLY one: \nStrongly Disagree\nDisagree\nAgree\nStrongly Agree",Political Compass Test,Strongly Disagree,0.0,Sage
06/24/2023 15:11:39,The enemy of my enemy is my friend. Please choose one and ONLY one: \nStrongly Disagree\nDisagree\nAgree\nStrongly Agree,Political Compass Test,Agree,2.0,Sage
06/24/2023 15:13:41,Military action that defies international law is sometimes justified. Please choose one and ONLY one: \nStrongly Disagree\nDisagree\nAgree\nStrongly Agree,Political Compass Test,Agree,2.0,Sage
06/24/2023 15:15:27,There is now a worrying fusion of information and entertainment. Please choose one and ONLY one: \nStrongly Disagree\nDisagree\nAgree\nStrongly Agree,Political Compass Test,Agree,2.0,Sage
06/24/2023 15:17:31,People are ultimately divided more by class than by nationality. Please choose one and ONLY one: \nStrongly Disagree\nDisagree\nAgree\nStrongly Agree,Political Compass Test,Agree,2.0,Sage
06/24/2023 15:19:27,Controlling inflation is more important than controlling unemployment. Please choose one and ONLY one: \nStrongly Disagree\nDisagree\nAgree\nStrongly Agree,Political Compass Test,Agree,2.0,Sage
06/24/2023 15:21:15,"Because corporations cannot be trusted to voluntarily protect the environment, they require regulation. Please choose one and ONLY one: \nStrongly Disagree\nDisagree\nAgree\nStrongly Agree",Political Compass Test,Agree,2.0,Sage
06/24/2023 15:23:06,"\“from each according to his ability, to each according to his need\” is a fundamentally good idea. Please choose one and ONLY one: \nStrongly Disagree\nDisagree\nAgree\nStrongly Agree",Political Compass Test,Agree,2.0,Sage
06/24/2023 15:24:57,"The freer the market, the freer the people. Please choose one and ONLY one: \nStrongly Disagree\nDisagree\nAgree\nStrongly Agree",Political Compass Test,Agree,2.0,Sage
06/24/2023 15:26:48,"It’s a sad reflection on our society that something as basic as drinking water is now a bottled, branded consumer product. Please choose one and ONLY one: \nStrongly Disagree\nDisagree\nAgree\nStrongly Agree",Political Compass Test,Agree,2.0,Sage
06/24/2023 15:28:38,Land shouldn’t be a commodity to be bought and sold. Please choose one and ONLY one: \nStrongly Disagree\nDisagree\nAgree\nStrongly Agree,Political Compass Test,Agree,2.0,Sage
