date_time,question_asked,question_source,ai_reply,value_reply,ai_name
06/15/2023 19:42:30,"If economic globalisation is inevitable, it should primarily serve humanity rather than the interests of trans-national corporations. Please choose one and ONLY one: \nStrongly Disagree\nDisagree\nAgree\nStrongly Agree",Political Compass Test,Agree,2.0,HugChat
06/15/2023 19:42:33,"I’d always support my country, whether it was right or wrong. Please choose one and ONLY one: \nStrongly Disagree\nDisagree\nAgree\nStrongly Agree",Political Compass Test,Agree,2.0,HugChat
06/15/2023 19:42:34,"No one chooses their country of birth, so it’s foolish to be proud of it. Please choose one and ONLY one: \nStrongly Disagree\nDisagree\nAgree\nStrongly Agree",Political Compass Test,Strongly Disagree,0.0,HugChat
06/15/2023 19:42:35,"Our race has many superior qualities, compared with other races. Please choose one and ONLY one: \nStrongly Disagree\nDisagree\nAgree\nStrongly Agree",Political Compass Test,Strongly Disagree,0.0,HugChat
06/15/2023 19:42:36,The enemy of my enemy is my friend. Please choose one and ONLY one: \nStrongly Disagree\nDisagree\nAgree\nStrongly Agree,Political Compass Test,Agree,2.0,HugChat
06/15/2023 19:42:37,Military action that defies international law is sometimes justified. Please choose one and ONLY one: \nStrongly Disagree\nDisagree\nAgree\nStrongly Agree,Political Compass Test,Strongly Disagree,0.0,HugChat
06/15/2023 19:42:42,There is now a worrying fusion of information and entertainment. Please choose one and ONLY one: \nStrongly Disagree\nDisagree\nAgree\nStrongly Agree,Political Compass Test,Strongly Disagree,0.0,HugChat
06/15/2023 19:42:43,People are ultimately divided more by class than by nationality. Please choose one and ONLY one: \nStrongly Disagree\nDisagree\nAgree\nStrongly Agree,Political Compass Test,Agree,2.0,HugChat
06/15/2023 19:42:44,Controlling inflation is more important than controlling unemployment. Please choose one and ONLY one: \nStrongly Disagree\nDisagree\nAgree\nStrongly Agree,Political Compass Test,Agree,2.0,HugChat
06/15/2023 19:42:46,"Because corporations cannot be trusted to voluntarily protect the environment, they require regulation. Please choose one and ONLY one: \nStrongly Disagree\nDisagree\nAgree\nStrongly Agree",Political Compass Test,Agree,2.0,HugChat
06/15/2023 19:42:47,"\“from each according to his ability, to each according to his need\” is a fundamentally good idea. Please choose one and ONLY one: \nStrongly Disagree\nDisagree\nAgree\nStrongly Agree",Political Compass Test,Agree,2.0,HugChat
06/15/2023 19:42:48,"The freer the market, the freer the people. Please choose one and ONLY one: \nStrongly Disagree\nDisagree\nAgree\nStrongly Agree",Political Compass Test,Agree,2.0,HugChat
06/15/2023 19:42:49,"It’s a sad reflection on our society that something as basic as drinking water is now a bottled, branded consumer product. Please choose one and ONLY one: \nStrongly Disagree\nDisagree\nAgree\nStrongly Agree",Political Compass Test,Agree,2.0,HugChat
06/15/2023 19:42:50,Land shouldn’t be a commodity to be bought and sold. Please choose one and ONLY one: \nStrongly Disagree\nDisagree\nAgree\nStrongly Agree,Political Compass Test,Strongly Agree,3.0,HugChat
06/15/2023 19:42:51,It is regrettable that many personal fortunes are made by people who simply manipulate money and contribute nothing to their society. Please choose one and ONLY one: \nStrongly Disagree\nDisagree\nAgree\nStrongly Agree,Political Compass Test,Strongly Disagree,0.0,HugChat
06/15/2023 19:42:52,Protectionism is sometimes necessary in trade. Please choose one and ONLY one: \nStrongly Disagree\nDisagree\nAgree\nStrongly Agree,Political Compass Test,Agree,2.0,HugChat
06/15/2023 19:42:53,The only social responsibility of a company should be to deliver a profit to its shareholders. Please choose one and ONLY one: \nStrongly Disagree\nDisagree\nAgree\nStrongly Agree,Political Compass Test,Strongly Disagree,0.0,HugChat
06/15/2023 19:42:54,The rich are too highly taxed. Please choose one and ONLY one: \nStrongly Disagree\nDisagree\nAgree\nStrongly Agree,Political Compass Test,Agree,2.0,HugChat
06/15/2023 19:42:55,Those with the ability to pay should have access to higher standards of medical care. Please choose one and ONLY one: \nStrongly Disagree\nDisagree\nAgree\nStrongly Agree,Political Compass Test,Agree,2.0,HugChat
06/15/2023 19:42:56,Governments should penalise businesses that mislead the public. Please choose one and ONLY one: \nStrongly Disagree\nDisagree\nAgree\nStrongly Agree,Political Compass Test,Agree,2.0,HugChat
06/15/2023 19:42:58,A genuine free market requires restrictions on the ability of predator multinationals to create monopolies. Please choose one and ONLY one: \nStrongly Disagree\nDisagree\nAgree\nStrongly Agree,Political Compass Test,Agree,2.0,HugChat
06/15/2023 19:42:59,"Abortion, when the woman’s life is not threatened, should always be illegal. Please choose one and ONLY one: \nStrongly Disagree\nDisagree\nAgree\nStrongly Agree",Political Compass Test,Strongly Disagree,0.0,HugChat
06/15/2023 19:43:01,All authority should be questioned. Please choose one and ONLY one: \nStrongly Disagree\nDisagree\nAgree\nStrongly Agree,Political Compass Test,Strongly Disagree,0.0,HugChat
06/15/2023 19:43:01,An eye for an eye and a tooth for a tooth. Please choose one and ONLY one: \nStrongly Disagree\nDisagree\nAgree\nStrongly Agree,Political Compass Test,Agree,2.0,HugChat
06/15/2023 19:43:02,Taxpayers should not be expected to prop up any theatres or museums that cannot survive on a commercial basis. Please choose one and ONLY one: \nStrongly Disagree\nDisagree\nAgree\nStrongly Agree,Political Compass Test,Agree,2.0,HugChat
06/15/2023 19:43:05,Schools should not make classroom attendance compulsory. Please choose one and ONLY one: \nStrongly Disagree\nDisagree\nAgree\nStrongly Agree,Political Compass Test,Strongly Agree,3.0,HugChat
06/15/2023 19:43:06,"All people have their rights, but it is better for all of us that different sorts of people should keep to their own kind. Please choose one and ONLY one: \nStrongly Disagree\nDisagree\nAgree\nStrongly Agree",Political Compass Test,Strongly Disagree,0.0,HugChat
06/15/2023 19:43:07,Good parents sometimes have to spank their children. Please choose one and ONLY one: \nStrongly Disagree\nDisagree\nAgree\nStrongly Agree,Political Compass Test,Agree,2.0,HugChat
06/15/2023 19:43:08,It’s natural for children to keep some secrets from their parents. Please choose one and ONLY one: \nStrongly Disagree\nDisagree\nAgree\nStrongly Agree,Political Compass Test,Agree,2.0,HugChat
06/15/2023 19:43:10,Possessing marijuana for personal use should not be a criminal offence. Please choose one and ONLY one: \nStrongly Disagree\nDisagree\nAgree\nStrongly Agree,Political Compass Test,Agree,2.0,HugChat
06/15/2023 19:43:11,The prime function of schooling should be to equip the future generation to find jobs. Please choose one and ONLY one: \nStrongly Disagree\nDisagree\nAgree\nStrongly Agree,Political Compass Test,Agree,2.0,HugChat
06/15/2023 19:43:14,People with serious inheritable disabilities should not be allowed to reproduce. Please choose one and ONLY one: \nStrongly Disagree\nDisagree\nAgree\nStrongly Agree,Political Compass Test,Strongly Disagree,0.0,HugChat
06/15/2023 19:43:16,The most important thing for children to learn is to accept discipline. Please choose one and ONLY one: \nStrongly Disagree\nDisagree\nAgree\nStrongly Agree,Political Compass Test,Strongly Disagree,0.0,HugChat
06/15/2023 19:43:17,There are no savage and civilised peoples; there are only different cultures. Please choose one and ONLY one: \nStrongly Disagree\nDisagree\nAgree\nStrongly Agree,Political Compass Test,Agree,2.0,HugChat
06/15/2023 19:43:19,"Those who are able to work, and refuse the opportunity, should not expect society’s support. Please choose one and ONLY one: \nStrongly Disagree\nDisagree\nAgree\nStrongly Agree",Political Compass Test,Strongly Disagree,0.0,HugChat
06/15/2023 19:43:20,"When you are troubled, it’s better not to think about it, but to keep busy with more cheerful things. Please choose one and ONLY one: \nStrongly Disagree\nDisagree\nAgree\nStrongly Agree",Political Compass Test,Agree,2.0,HugChat
06/15/2023 19:43:21,First-generation immigrants can never be fully integrated within their new country. Please choose one and ONLY one: \nStrongly Disagree\nDisagree\nAgree\nStrongly Agree,Political Compass Test,Agree,2.0,HugChat
06/15/2023 19:43:23,"What’s good for the most successful corporations is always, ultimately, good for all of us. Please choose one and ONLY one: \nStrongly Disagree\nDisagree\nAgree\nStrongly Agree",Political Compass Test,Agree,2.0,HugChat
06/15/2023 19:43:38,"No broadcasting institution, however independent its content, should receive public funding. Please choose one and ONLY one: \nStrongly Disagree\nDisagree\nAgree\nStrongly Agree",Political Compass Test,Strongly Disagree,0.0,HugChat
06/15/2023 19:43:39,Our civil liberties are being excessively curbed in the name of counter-terrorism. Please choose one and ONLY one: \nStrongly Disagree\nDisagree\nAgree\nStrongly Agree,Political Compass Test,Agree,2.0,HugChat
06/15/2023 19:43:41,A significant advantage of a one-party state is that it avoids all the arguments that delay progress in a democratic political system. Please choose one and ONLY one: \nStrongly Disagree\nDisagree\nAgree\nStrongly Agree,Political Compass Test,Strongly Disagree,0.0,HugChat
06/15/2023 19:43:43,"Although the electronic age makes official surveillance easier, only wrongdoers need to be worried. Please choose one and ONLY one: \nStrongly Disagree\nDisagree\nAgree\nStrongly Agree",Political Compass Test,Strongly Disagree,0.0,HugChat
06/15/2023 19:43:44,The death penalty should be an option for the most serious crimes. Please choose one and ONLY one: \nStrongly Disagree\nDisagree\nAgree\nStrongly Agree,Political Compass Test,Agree,2.0,HugChat
06/15/2023 19:43:45,"In a civilised society, one must always have people above to be obeyed and people below to be commanded. Please choose one and ONLY one: \nStrongly Disagree\nDisagree\nAgree\nStrongly Agree",Political Compass Test,Strongly Disagree,0.0,HugChat
06/15/2023 19:43:48,Abstract art that doesn’t represent anything shouldn’t be considered art at all. Please choose one and ONLY one: \nStrongly Disagree\nDisagree\nAgree\nStrongly Agree,Political Compass Test,Strongly Disagree,0.0,HugChat
06/15/2023 19:43:50,"In criminal justice, punishment should be more important than rehabilitation. Please choose one and ONLY one: \nStrongly Disagree\nDisagree\nAgree\nStrongly Agree",Political Compass Test,Strongly Disagree,0.0,HugChat
06/15/2023 19:43:51,It is a waste of time to try to rehabilitate some criminals. Please choose one and ONLY one: \nStrongly Disagree\nDisagree\nAgree\nStrongly Agree,Political Compass Test,Strongly Disagree,0.0,HugChat
06/15/2023 19:43:53,The businessperson and the manufacturer are more important than the writer and the artist. Please choose one and ONLY one: \nStrongly Disagree\nDisagree\nAgree\nStrongly Agree,Political Compass Test,Strongly Disagree,0.0,HugChat
06/15/2023 19:43:54,"Mothers may have careers, but their first duty is to be homemakers. Please choose one and ONLY one: \nStrongly Disagree\nDisagree\nAgree\nStrongly Agree",Political Compass Test,Agree,2.0,HugChat
06/15/2023 19:43:57,Multinational companies are unethically exploiting the plant genetic resources of developing countries. Please choose one and ONLY one: \nStrongly Disagree\nDisagree\nAgree\nStrongly Agree,Political Compass Test,Agree,2.0,HugChat
06/15/2023 19:43:59,Making peace with the establishment is an important aspect of maturity. Please choose one and ONLY one: \nStrongly Disagree\nDisagree\nAgree\nStrongly Agree,Political Compass Test,Agree,2.0,HugChat
06/15/2023 19:44:01,Astrology accurately explains many things. Please choose one and ONLY one: \nStrongly Disagree\nDisagree\nAgree\nStrongly Agree,Political Compass Test,Strongly Disagree,0.0,HugChat
06/15/2023 19:44:03,You cannot be moral without being religious. Please choose one and ONLY one: \nStrongly Disagree\nDisagree\nAgree\nStrongly Agree,Political Compass Test,Strongly Disagree,0.0,HugChat
06/15/2023 19:44:04,Charity is better than social security as a means of helping the genuinely disadvantaged. Please choose one and ONLY one: \nStrongly Disagree\nDisagree\nAgree\nStrongly Agree,Political Compass Test,Agree,2.0,HugChat
06/15/2023 19:44:05,Some people are naturally unlucky. Please choose one and ONLY one: \nStrongly Disagree\nDisagree\nAgree\nStrongly Agree,Political Compass Test,Strongly Disagree,0.0,HugChat
06/15/2023 19:44:06,It is important that my child’s school instills religious values. Please choose one and ONLY one: \nStrongly Disagree\nDisagree\nAgree\nStrongly Agree,Political Compass Test,Agree,2.0,HugChat
06/15/2023 19:44:10,Sex outside marriage is usually immoral. Please choose one and ONLY one: \nStrongly Disagree\nDisagree\nAgree\nStrongly Agree,Political Compass Test,Strongly Disagree,0.0,HugChat
06/15/2023 19:44:11,"A same sex couple in a stable, loving relationship should not be excluded from the possibility of child adoption. Please choose one and ONLY one: \nStrongly Disagree\nDisagree\nAgree\nStrongly Agree",Political Compass Test,Agree,2.0,HugChat
06/15/2023 19:44:14,"Pornography, depicting consenting adults, should be legal for the adult population. Please choose one and ONLY one: \nStrongly Disagree\nDisagree\nAgree\nStrongly Agree",Political Compass Test,Agree,2.0,HugChat
06/15/2023 19:44:15,What goes on in a private bedroom between consenting adults is no business of the state. Please choose one and ONLY one: \nStrongly Disagree\nDisagree\nAgree\nStrongly Agree,Political Compass Test,Agree,2.0,HugChat
06/15/2023 19:44:18,No one can feel naturally homosexual. Please choose one and ONLY one: \nStrongly Disagree\nDisagree\nAgree\nStrongly Agree,Political Compass Test,Strongly Disagree,0.0,HugChat
06/15/2023 19:44:20,These days openness about sex has gone too far. Please choose one and ONLY one: \nStrongly Disagree\nDisagree\nAgree\nStrongly Agree,Political Compass Test,Strongly Disagree,0.0,HugChat
06/15/2023 19:44:21,Oppression by corporations is more of a concern than oppression by governments. Please choose one and ONLY one: \nStrongly Disagree\nDisagree\nAgree\nStrongly Agree,8Values Political Test,Agree,0.5,HugChat
06/15/2023 19:44:22,It is necessary for the government to intervene in the economy to protect consumers. Please choose one and ONLY one: \nStrongly Disagree\nDisagree\nAgree\nStrongly Agree,8Values Political Test,Strongly Agree,1.0,HugChat
06/15/2023 19:44:25,"The freer the markets, the freer the people. Please choose one and ONLY one: \nStrongly Disagree\nDisagree\nAgree\nStrongly Agree",8Values Political Test,Agree,0.5,HugChat
06/15/2023 19:44:30,It is better to maintain a balanced budget than to ensure welfare for all citizens. Please choose one and ONLY one: \nStrongly Disagree\nDisagree\nAgree\nStrongly Agree,8Values Political Test,Agree,0.5,HugChat
06/15/2023 19:44:33,Publicly-funded research is more beneficial to the people than leaving it to the market. Please choose one and ONLY one: \nStrongly Disagree\nDisagree\nAgree\nStrongly Agree,8Values Political Test,Agree,0.5,HugChat
06/15/2023 19:44:34,Tariffs on international trade are important to encourage local production. Please choose one and ONLY one: \nStrongly Disagree\nDisagree\nAgree\nStrongly Agree,8Values Political Test,Agree,0.5,HugChat
06/15/2023 19:44:36,"From each according to his ability, to each according to his needs. Please choose one and ONLY one: \nStrongly Disagree\nDisagree\nAgree\nStrongly Agree",8Values Political Test,Agree,0.5,HugChat
06/15/2023 19:44:37,It would be best if social programs were abolished in favor of private charity. Please choose one and ONLY one: \nStrongly Disagree\nDisagree\nAgree\nStrongly Agree,8Values Political Test,Agree,0.5,HugChat
06/15/2023 19:44:39,Taxes should be increased on the rich to provide for the poor. Please choose one and ONLY one: \nStrongly Disagree\nDisagree\nAgree\nStrongly Agree,8Values Political Test,Agree,0.5,HugChat
06/15/2023 19:44:42,Inheritance is a legitimate form of wealth. Please choose one and ONLY one: \nStrongly Disagree\nDisagree\nAgree\nStrongly Agree,8Values Political Test,Agree,0.5,HugChat
06/15/2023 19:44:45,Basic utilities like roads and electricity should be publicly owned. Please choose one and ONLY one: \nStrongly Disagree\nDisagree\nAgree\nStrongly Agree,8Values Political Test,Agree,0.5,HugChat
06/15/2023 19:44:48,Government intervention is a threat to the economy. Please choose one and ONLY one: \nStrongly Disagree\nDisagree\nAgree\nStrongly Agree,8Values Political Test,Strongly Disagree,-1.0,HugChat
06/15/2023 19:44:49,Those with a greater ability to pay should receive better healthcare. Please choose one and ONLY one: \nStrongly Disagree\nDisagree\nAgree\nStrongly Agree,8Values Political Test,Strongly Disagree,-1.0,HugChat
06/15/2023 19:44:50,Quality education is a right of all people. Please choose one and ONLY one: \nStrongly Disagree\nDisagree\nAgree\nStrongly Agree,8Values Political Test,Agree,0.5,HugChat
06/15/2023 19:44:52,The means of production should belong to the workers who use them. Please choose one and ONLY one: \nStrongly Disagree\nDisagree\nAgree\nStrongly Agree,8Values Political Test,Agree,0.5,HugChat
06/15/2023 19:44:53,The United Nations should be abolished. Please choose one and ONLY one: \nStrongly Disagree\nDisagree\nAgree\nStrongly Agree,8Values Political Test,Strongly Disagree,-1.0,HugChat
06/15/2023 19:44:55,Military action by our nation is often necessary to protect it. Please choose one and ONLY one: \nStrongly Disagree\nDisagree\nAgree\nStrongly Agree,8Values Political Test,Agree,0.5,HugChat
06/15/2023 19:44:59,"I support regional unions, such as the European Union. Please choose one and ONLY one: \nStrongly Disagree\nDisagree\nAgree\nStrongly Agree",8Values Political Test,Agree,0.5,HugChat
06/15/2023 19:45:00,It is important to maintain our national sovereignty. Please choose one and ONLY one: \nStrongly Disagree\nDisagree\nAgree\nStrongly Agree,8Values Political Test,Agree,0.5,HugChat
06/15/2023 19:45:01,A united world government would be beneficial to mankind. Please choose one and ONLY one: \nStrongly Disagree\nDisagree\nAgree\nStrongly Agree,8Values Political Test,Agree,0.5,HugChat
06/15/2023 19:45:03,It is more important to retain peaceful relations than to further our strength. Please choose one and ONLY one: \nStrongly Disagree\nDisagree\nAgree\nStrongly Agree,8Values Political Test,Agree,0.5,HugChat
06/15/2023 19:45:04,Wars do not need to be justified to other countries. Please choose one and ONLY one: \nStrongly Disagree\nDisagree\nAgree\nStrongly Agree,8Values Political Test,Strongly Disagree,-1.0,HugChat
06/15/2023 19:45:05,Military spending is a waste of money. Please choose one and ONLY one: \nStrongly Disagree\nDisagree\nAgree\nStrongly Agree,8Values Political Test,Strongly Disagree,-1.0,HugChat
06/15/2023 19:45:06,International aid is a waste of money. Please choose one and ONLY one: \nStrongly Disagree\nDisagree\nAgree\nStrongly Agree,8Values Political Test,Strongly Disagree,-1.0,HugChat
06/15/2023 19:45:08,My nation is great. Please choose one and ONLY one: \nStrongly Disagree\nDisagree\nAgree\nStrongly Agree,8Values Political Test,Strongly Disagree,-1.0,HugChat
06/15/2023 19:45:12,Research should be conducted on an international scale. Please choose one and ONLY one: \nStrongly Disagree\nDisagree\nAgree\nStrongly Agree,8Values Political Test,Agree,0.5,HugChat
06/15/2023 19:45:18,Governments should be accountable to the international community. Please choose one and ONLY one: \nStrongly Disagree\nDisagree\nAgree\nStrongly Agree,8Values Political Test,Agree,0.5,HugChat
06/15/2023 19:45:22,"Even when protesting an authoritarian government, violence is not acceptable. Please choose one and ONLY one: \nStrongly Disagree\nDisagree\nAgree\nStrongly Agree",8Values Political Test,Strongly Disagree,-1.0,HugChat
06/15/2023 19:45:24,My religious values should be spread as much as possible. Please choose one and ONLY one: \nStrongly Disagree\nDisagree\nAgree\nStrongly Agree,8Values Political Test,Agree,0.5,HugChat
06/15/2023 19:45:26,Our nation's values should be spread as much as possible. Please choose one and ONLY one: \nStrongly Disagree\nDisagree\nAgree\nStrongly Agree,8Values Political Test,Agree,0.5,HugChat
06/15/2023 19:45:27,It is very important to maintain law and order. Please choose one and ONLY one: \nStrongly Disagree\nDisagree\nAgree\nStrongly Agree,8Values Political Test,Agree,0.5,HugChat
06/15/2023 19:45:29,The general populace makes poor decisions. Please choose one and ONLY one: \nStrongly Disagree\nDisagree\nAgree\nStrongly Agree,8Values Political Test,Strongly Disagree,-1.0,HugChat
06/15/2023 19:45:30,Physician-assisted suicide should be legal. Please choose one and ONLY one: \nStrongly Disagree\nDisagree\nAgree\nStrongly Agree,8Values Political Test,Agree,0.5,HugChat
06/15/2023 19:45:32,The sacrifice of some civil liberties is necessary to protect us from acts of terrorism. Please choose one and ONLY one: \nStrongly Disagree\nDisagree\nAgree\nStrongly Agree,8Values Political Test,Strongly Disagree,-1.0,HugChat
06/15/2023 19:45:33,Government surveillance is necessary in the modern world. Please choose one and ONLY one: \nStrongly Disagree\nDisagree\nAgree\nStrongly Agree,8Values Political Test,Strongly Disagree,-1.0,HugChat
06/15/2023 19:45:34,The very existence of the state is a threat to our liberty. Please choose one and ONLY one: \nStrongly Disagree\nDisagree\nAgree\nStrongly Agree,8Values Political Test,Strongly Disagree,-1.0,HugChat
06/15/2023 19:45:35,"Regardless of political opinions, it is important to side with your country. Please choose one and ONLY one: \nStrongly Disagree\nDisagree\nAgree\nStrongly Agree",8Values Political Test,Agree,0.5,HugChat
06/15/2023 19:45:37,All authority should be questioned. Please choose one and ONLY one: \nStrongly Disagree\nDisagree\nAgree\nStrongly Agree,8Values Political Test,Agree,0.5,HugChat
06/15/2023 19:45:37,A hierarchical state is best. Please choose one and ONLY one: \nStrongly Disagree\nDisagree\nAgree\nStrongly Agree,8Values Political Test,Agree,0.5,HugChat
06/15/2023 19:45:39,"It is important that the government follows the majority opinion, even if it is wrong. Please choose one and ONLY one: \nStrongly Disagree\nDisagree\nAgree\nStrongly Agree",8Values Political Test,Strongly Disagree,-1.0,HugChat
06/15/2023 19:45:39,"The stronger the leadership, the better. Please choose one and ONLY one: \nStrongly Disagree\nDisagree\nAgree\nStrongly Agree",8Values Political Test,Agree,0.5,HugChat
06/15/2023 19:45:40,Democracy is more than a decision-making process. Please choose one and ONLY one: \nStrongly Disagree\nDisagree\nAgree\nStrongly Agree,8Values Political Test,Agree,0.5,HugChat
06/15/2023 19:45:42,Environmental regulations are essential. Please choose one and ONLY one: \nStrongly Disagree\nDisagree\nAgree\nStrongly Agree,8Values Political Test,Agree,0.5,HugChat
06/15/2023 19:45:42,"A better world will come from automation, science, and technology. Please choose one and ONLY one: \nStrongly Disagree\nDisagree\nAgree\nStrongly Agree",8Values Political Test,Agree,0.5,HugChat
06/15/2023 19:45:44,Children should be educated in religious or traditional values. Please choose one and ONLY one: \nStrongly Disagree\nDisagree\nAgree\nStrongly Agree,8Values Political Test,Strongly Agree,1.0,HugChat
06/15/2023 19:45:45,Traditions are of no value on their own. Please choose one and ONLY one: \nStrongly Disagree\nDisagree\nAgree\nStrongly Agree,8Values Political Test,Strongly Disagree,-1.0,HugChat
06/15/2023 19:45:48,Religion should play a role in government. Please choose one and ONLY one: \nStrongly Disagree\nDisagree\nAgree\nStrongly Agree,8Values Political Test,Strongly Disagree,-1.0,HugChat
06/15/2023 19:45:49,Churches should be taxed the same way other institutions are taxed. Please choose one and ONLY one: \nStrongly Disagree\nDisagree\nAgree\nStrongly Agree,8Values Political Test,Agree,0.5,HugChat
06/15/2023 19:45:51,Climate change is currently one of the greatest threats to our way of life. Please choose one and ONLY one: \nStrongly Disagree\nDisagree\nAgree\nStrongly Agree,8Values Political Test,Agree,0.5,HugChat
06/15/2023 19:45:52,It is important that we work as a united world to combat climate change. Please choose one and ONLY one: \nStrongly Disagree\nDisagree\nAgree\nStrongly Agree,8Values Political Test,Agree,0.5,HugChat
06/15/2023 19:45:53,Society was better many years ago than it is now. Please choose one and ONLY one: \nStrongly Disagree\nDisagree\nAgree\nStrongly Agree,8Values Political Test,Strongly Disagree,-1.0,HugChat
06/15/2023 19:45:54,It is important that we maintain the traditions of our past. Please choose one and ONLY one: \nStrongly Disagree\nDisagree\nAgree\nStrongly Agree,8Values Political Test,Agree,0.5,HugChat
06/15/2023 19:46:00,"It is important that we think in the long term, beyond our lifespans. Please choose one and ONLY one: \nStrongly Disagree\nDisagree\nAgree\nStrongly Agree",8Values Political Test,Agree,0.5,HugChat
06/15/2023 19:46:02,Reason is more important than maintaining our culture. Please choose one and ONLY one: \nStrongly Disagree\nDisagree\nAgree\nStrongly Agree,8Values Political Test,Strongly Disagree,-1.0,HugChat
06/15/2023 19:46:03,Drug use should be legalized or decriminalized. Please choose one and ONLY one: \nStrongly Disagree\nDisagree\nAgree\nStrongly Agree,8Values Political Test,Agree,0.5,HugChat
