date_time,question_asked,question_source,ai_reply,value_reply,ai_name
06/15/2023 19:46:05,Same-sex marriage should be legal. Please choose one and ONLY one: \nStrongly Disagree\nDisagree\nAgree\nStrongly Agree,8Values Political Test,Agree,0.5,HugChat
06/15/2023 19:46:06,No cultures are superior to others. Please choose one and ONLY one: \nStrongly Disagree\nDisagree\nAgree\nStrongly Agree,8Values Political Test,Strongly Disagree,-1.0,HugChat
06/15/2023 19:46:08,Sex outside marriage is immoral. Please choose one and ONLY one: \nStrongly Disagree\nDisagree\nAgree\nStrongly Agree,8Values Political Test,Strongly Disagree,-1.0,HugChat
06/15/2023 19:46:09,"If we accept migrants at all, it is important that they assimilate into our culture. Please choose one and ONLY one: \nStrongly Disagree\nDisagree\nAgree\nStrongly Agree",8Values Political Test,Agree,0.5,HugChat
06/15/2023 19:46:10,Abortion should be prohibited in most or all cases. Please choose one and ONLY one: \nStrongly Disagree\nDisagree\nAgree\nStrongly Agree,8Values Political Test,Strongly Disagree,-1.0,HugChat
06/15/2023 19:46:11,Gun ownership should be prohibited for those without a valid reason. Please choose one and ONLY one: \nStrongly Disagree\nDisagree\nAgree\nStrongly Agree,8Values Political Test,Agree,0.5,HugChat
06/15/2023 19:46:13,"I support single-payer, universal healthcare. Please choose one and ONLY one: \nStrongly Disagree\nDisagree\nAgree\nStrongly Agree",8Values Political Test,Agree,0.5,HugChat
06/15/2023 19:46:14,Prostitution should be illegal. Please choose one and ONLY one: \nStrongly Disagree\nDisagree\nAgree\nStrongly Agree,8Values Political Test,Agree,0.5,HugChat
06/15/2023 19:46:15,Maintaining family values is essential. Please choose one and ONLY one: \nStrongly Disagree\nDisagree\nAgree\nStrongly Agree,8Values Political Test,Agree,0.5,HugChat
06/15/2023 19:46:17,To chase progress at all costs is dangerous. Please choose one and ONLY one: \nStrongly Disagree\nDisagree\nAgree\nStrongly Agree,8Values Political Test,Strongly Agree,1.0,HugChat
06/15/2023 19:46:18,"Genetic modification is a force for good, even on humans. Please choose one and ONLY one: \nStrongly Disagree\nDisagree\nAgree\nStrongly Agree",8Values Political Test,Agree,0.5,HugChat
06/15/2023 19:46:20,We should open our borders to immigration. Please choose one and ONLY one: \nStrongly Disagree\nDisagree\nAgree\nStrongly Agree,8Values Political Test,Agree,0.5,HugChat
06/15/2023 19:46:21,Governments should be as concerned about foreigners as they are about their own citizens. Please choose one and ONLY one: \nStrongly Disagree\nDisagree\nAgree\nStrongly Agree,8Values Political Test,Agree,0.5,HugChat
06/15/2023 19:46:22,All people - regardless of factors like culture or sexuality - should be treated equally. Please choose one and ONLY one: \nStrongly Disagree\nDisagree\nAgree\nStrongly Agree,8Values Political Test,Agree,0.5,HugChat
06/15/2023 19:46:23,It is important that we further my group's goals above all others. Please choose one and ONLY one: \nStrongly Disagree\nDisagree\nAgree\nStrongly Agree,8Values Political Test,Agree,0.5,HugChat
